"fifi-fifi-8096238";"Fifi Fifi";;"https://www.linkedin.com/in/fifi-fifi-8096238/";"Fifi";"Fifi";"Head of Business Continuity, Compliance Quality Assurance, Investment Risk & Compliance";"https://media.licdn.com/dms/image/C5103AQG-ZT9KY83EEA/profile-displayphoto-shrink_200_200/0?e=1577318400&v=beta&t=GSiWXlpfxIvH7YutmTwRA2BPImmQKtF8fynsA4m-CHo";"Singapore";;;"Fifi specializes in Asset Management industry. She has worked in both local and multi national asset management companies (Citigroup Asset Management, UOB Asset Management and Allianz Global Investors).  She has experienced in Performance, Portfolio/Investment Risk, Risk Management (including Operational Risk, Market Risk and Reputational Risk), setting up Risk Management team and ensuring its compliance to both risk management framework and regulatory compliance. She has overseas experiences by working in numerous both regular and project based risk related matters with the business in Hong Kong, Taiwan, Japan and South Korea.  She chairs various Risk Committee meetings  across countries in Asia. Due to her job nature, she has strong both quantitative and qualitative skills. She has frequent interaction with colleagues and senior management across regions (Europe and US). She has strong team leadership skill, interpersonal skill and project management.";;;;;;;;;;;;;;;;;"Prudential Assurance Company Singapore";"Head of Business Continuity, Compliance Quality Assurance, Investment Risk & Compliance";"Feb 2019";"PRESENT";"• Responsible in overseeing the above areas and lead a team of 4 personnel.";"Singapore";"https://www.linkedin.com/company/prudential-assurance-company-singapore";"prudential-assurance-company-singapore";;;"Manulife Asset Management";"Head Of Risk Management";"May 2018";"Feb 2019";"Provide independent risk oversight for Singapore, Malaysia, Thailand and Vietnam activities.";"Singapore";"https://www.linkedin.com/company/manulife-investment-management";"manulife-investment-management";;;"Allianz Global Investors";"Acting Head of Risk Management, Asia Pacific and Head of Risk Management, Singapore";"Jul 2016";"Mar 2017";"• Requested to step up as Acting Head of Risk Management, Asia Pacific, as the person in-charged has decided to pursue other opportunities outside the organization. • Managing Risk Management teams across Asia (8 personnels). • Participate in regional management meetings, committees (AP Risk Management Com";"Singapore";"https://www.linkedin.com/company/allianz-global-investors";"allianz-global-investors";;;"Allianz Global Investors";"Head of Risk Management, Singapore";"2015";"Mar 2017";"• Promoted to become Head of Risk Management, Singapore. There is no change in job scope.";"Singapore";"https://www.linkedin.com/company/allianz-global-investors";"allianz-global-investors";;;"Allianz Global Investors";"Risk Manager (Focus: Portfolio Risk)";"2013";"2014";"• With an enhancement in the structural organization, my role has changed to Risk Manager. I am still assisted with an assistant of one Risk Analyst and reporting line to Head of Risk Management, Asia Pacific • On local level (Singapore), I am responsible in overseeing risks (Portfolio Risk (inclusive";"Singapore";"https://www.linkedin.com/company/allianz-global-investors";"allianz-global-investors";;;"Allianz Global Investors";"Portfolio & Investment Risk Manager, Asia Pacific";"Oct 2008";"2013";"• A regional role with an assistant of one Portfolio & Investment Risk Analyst and reporting line to Head of Risk Management, Asia Pacific • Built up a performance measurement and investment risk analysis and monitoring in Asia Pacific (Singapore, Korea and Taiwan)";"Singapore";"https://www.linkedin.com/company/allianz-global-investors";"allianz-global-investors";;;"UOB Asset Management";"Performance & Risk Analyst";"Dec 2005";"Oct 2008";"• Managed a team 5 of performance & risk analysts including setting up the team’s roles in the company, its annual business plans, road map and KPI of the team • Responsible in shaping up the team’s workflow and procedures • Responsible for ensuring that the company complies with the guidelines stipulated un";"Singapore";"https://www.linkedin.com/company/uob-asset-management";"uob-asset-management";;;"Aston Business School";"Master of Science";"Financial Management and Control";"";"2000";"2001";"";"UNSW";"Bachelor of Commerce (B.Com.)";"Finance";"";"1996";"1999";"";;;;;;;;"""Portfolio Risk : 0, Portfolio Management : 0, Asset Management : 0, Equities : 0, Fixed Income : 0, Risk Management : 0, Investments : 0, Financial Risk : 0, Market Risk : 0, investment risk : 0, """;"";3;;"Financial Services";;;;;"Hays; UOB Asset Management; Aston University; Manulife; UNSW; Maybank"
"calvin-low-7156ba6b";"Calvin Low";;"https://www.linkedin.com/in/calvin-low-7156ba6b/";"Calvin";"Low";"Head, Client Servicing (EBS)";"https://media.licdn.com/dms/image/C5103AQGOeMrFMMW4rQ/profile-displayphoto-shrink_200_200/0?e=1577318400&v=beta&t=yGQ2VzxKqnfysz2VRTTHmL5L-NkH_yfXdz1RmBgRcfs";"Singapore";;;"";;;;;;;;;;;;;;;;;"Prudential Assurance Company Singapore";"Head, Client Servicing (EBS)";"Apr 2019";"PRESENT";"";"";"https://www.linkedin.com/company/prudential-assurance-company-singapore";"prudential-assurance-company-singapore";;;"Mercer";"Director";"2013";"PRESENT";"";"";"https://www.linkedin.com/company/mercer";"mercer";;;"Aviva Ltd";"Manager";"2008";"2013";"";"";"https://www.linkedin.com/company/aviva-plc";"aviva-plc";;;"NTUC Income";"Sales Manager";"2000";"2008";"";"";"https://www.linkedin.com/company/income";"income";;;;;;;;;;;;;;;;;;;;;;;;;;;;;;;;;;;;;;;;;;;;;;;;;;;;;;"""Insurance : 19, General Insurance : 12, Life Insurance : 11, Financial Services : 8, Strategy : 8, Health Insurance : 7, Claims Management : 6, Sales : 6, Employee Benefits : 5, Change Management : 5, Risk Management : 5, Business Strategy : 4, Business Development : 4, Financial Risk : 3, Business Analysis : 2, Commercial Insurance : 2, Recruiting : 1, Strategic Planning : 1, Term Life Insurance : 1, Management : 10, Brokers : 2, Customer Service : 1, Working with Brokers : 1, Business Relationship Management : 1, New Business Development : 1, Relationship Management : 7, """;"322";3;;"Financial Services";;;;;"Aviva; Income; Assure (Singapore) Pte Ltd; Mercer–Health; Prudential Assurance Company Singapore; Mercer"
"lee-jiat-liauw-2831b326";"Lee Jiat Liauw";;"https://www.linkedin.com/in/lee-jiat-liauw-2831b326/";"Lee";"Liauw";"Head of Business Finance at Prudential Assurance Company Singapore";"https://media.licdn.com/dms/image/C5103AQFKGMinKulhaQ/profile-displayphoto-shrink_200_200/0?e=1577318400&v=beta&t=hgjMW66p-909ZfJ99kNVQFzGdzLRymxpbnOLfGeCLWc";"Singapore";;;"";;;;;;;;;;;;;;;;;"Prudential Assurance Company Singapore";"Head of Business Finance";"Nov 2018";"PRESENT";"Covering performance management, distribution compensation, finance business partnering and distribution sales reporting.";"Singapore";"https://www.linkedin.com/company/prudential-assurance-company-singapore";"prudential-assurance-company-singapore";;;"Prudential Assurance Company Singapore";"Head of Finance Business Partnerships";"Apr 2018";"Oct 2018";"Working closely with all parts of the company to understand the business needs and how it will bring economic value";"";"https://www.linkedin.com/company/prudential-assurance-company-singapore";"prudential-assurance-company-singapore";;;"Prudential Assurance Company Singapore";"Vice President, Head of Distribution Compensation & Analytics";"Jan 2017";"Mar 2018";"Head of Distribution Compensation. Working closely with distribution channels to build effective compensation tools aligned with business goals";"";"https://www.linkedin.com/company/prudential-assurance-company-singapore";"prudential-assurance-company-singapore";;;"Prudential Assurance Company Singapore";"Deputy Vice President";"Sep 2014";"Dec 2016";"In charge of Finance Analytics for the review of distribution compensation";"Singapore";"https://www.linkedin.com/company/prudential-assurance-company-singapore";"prudential-assurance-company-singapore";;;"Prudential Assurance Corporation Singapore";"Deputy Vice President";"Aug 2013";"Sep 2014";"In charge of projects and investigation within Actuarial Department";"Singapore";"https://www.linkedin.com/company/prudentialuk";"prudentialuk";;;"Aviva Ltd";"Head of Capital Management & Profit Reporting + Appointed Actuary (HK)";"Aug 2011";"Dec 2012";"";"Singapore";"https://www.linkedin.com/company/aviva-plc";"aviva-plc";;;"Aviva Ltd";"Actuarial Senior Manager - Capital Management (SIN & HK)";"Feb 2009";"Oct 2011";"";"";"https://www.linkedin.com/company/aviva-plc";"aviva-plc";;;;;;;;;;;;;;;;;;;;;;;;"""Insurance : 9, Life Insurance : 8, MCEV : 6, Actuarial : 3, Liability : 2, Solvency II : 5, """;"343";3;;"Financial Services";;;;;"Forbes; CNN Business; South China Morning Post SCMP; Prudential Assurance Company Singapore; The Economist; The Wall Street Journal"
"edgar-jose-badiola-jr-39732096";"Edgar Jose Badiola Jr";;"https://www.linkedin.com/in/edgar-jose-badiola-jr-39732096/";"Edgar";"Jr";"International Business - Financial Consultant at Prudential Assurance Company Singapore";"https://media.licdn.com/dms/image/C4E03AQERL6Z7H9tLdA/profile-displayphoto-shrink_200_200/0?e=1577318400&v=beta&t=aJkt0o5PENxRSwgWaCwMSJ3BnaWxABMjw-9kgXfB45Q";"Singapore";;"May 2";"";;;;;;;;;;;;;;;;;"Prudential Assurance Company Singapore";"International Business - Financial Consultant";"2017";"PRESENT";"";"Singapore";"https://www.linkedin.com/company/prudential-assurance-company-singapore";"prudential-assurance-company-singapore";;;"AIA";"Financial Services Consultant";"Oct 2015";"2017";"";"Singapore";"https://www.linkedin.com/company/aia";"aia";;;"PwC";"Associate";"2014";"less than a year";"• Responsible in managing Accounts Payable. • Responsible in processing payments (GIRO, SAP In-house Bank, Manual Cheque) • Daily downloading of Online Bank statements – Booking and reconciling GIRO deductions/payments. • Responsible in assisting Vendor queries such as payment summary, details, and reconciliations. • Vouching and booking vendor invoices (in SAP) and reconciling statement of accounts. • Vouching volume customer cheque payments to be banked-in. • Responsible on preparing staff claim and ensure all filings are correct and accurate. (CONCUR System) • Online bank Priority, Prompt, and Petty cash payments. ( HSBC) • Work closely with the client for the month-end closing process • Any Ad Hoc finance duties given from time to time. ( Filing, Audit requests, Reconciliation)";"Singapore";"https://www.linkedin.com/search/results/index/?keywords=PwC";;;;"BDO Unibank, Inc.";"Accounting Assistant";"Apr 2011";"Dec 2013";"• Responsible in vouching, batching and balancing day-to-day bank transaction. • Responsible for call back of transactions for the day and daily end of day balancing. • Responsible for ensuring completeness and validity of all checks local, regional, out of town and foreign currency.";"Philippines";"https://www.linkedin.com/search/results/index/?keywords=BDO%20Unibank%2C%20Inc.";;;;"LBC Development Bank";"Customer Service Associate – New Accounts & Teller";"2009";"2011";"• Market Deposit Account products, Entertain and Service Clients, Accommodate product related queries from walk-in future clients , Open Savings, Current, and Time deposit Accounts, Prepare Daily Account related reports, Prepare/ Process MC’s &CC’s, Personalized and Pre-numbered ATM requests, Resolve Client Complaints, Monitor Accounts Provide Excellent Costumer and";"Philippines";"https://www.linkedin.com/search/results/index/?keywords=LBC%20Development%20Bank";;;;;;;;;;;;;;;;;;;;;;;;"ATENEO DE NAGA UNIVERSITY";"Bachelor of Science in Business Administration";"Major in Computer Management and Accountancy";"";"2007";"PRESENT";"";;;;;;;;;;;;;;;"""Accounts Payable : 4, Account Reconciliation : 4, Accounting : 4, •	Adequate knowledge in accounting and bookkeeping                              •	Adequate knowledge in accounting and bookkeeping : 0, •	Ability to analyze comparative data and source documents                              •	Ability to analyze comparative data and source documents : 0, •	Adequate knowledge in SAP (CDE Production and TEP)                              •	Adequate knowledge in SAP (CDE Production and TEP) : 0, •	Proficient in Microsoft Office Suite and AS 400                              •	Proficient in Microsoft Office Suite and AS 400 : 0, •	Ability to manage people : 0, •	Ability to organize events such as seminars and trainings                              •	Ability to organize events such as seminars and trainings : 0, •	Able to promote harmonious relationship within the work environment                              •	Able to promote harmonious relationship within the work environment : 0, •	Ability to conduct research works : 0, •	With excellent communication skills : 0, •	Willing to be trained : 0, •	Taking initiative in the work field : 0, •	Has a positive attitude and is open-minded                              •	Has a positive attitude and is open-minded : 0, """;"";3;;"Financial Services";;;;;"Tom Hood, CPA,CITP,CGMA; Google; AkzoNobel; Zurich Insurance Company Ltd; Alistair Cox; Sallie Krawcheck"
"justin-chu-朱诿坚）-73725836";"Justin Chu (朱诿坚）";;"https://www.linkedin.com/in/justin-chu-朱诿坚）-73725836/";"Justin";"Chu";"Head, Enterprise Business Operations at Prudential Assurance Company Singapore";"https://media.licdn.com/dms/image/C5603AQFkl_PGjbvcAA/profile-displayphoto-shrink_200_200/0?e=1577318400&v=beta&t=xjcBKIp789mifKRhzb3Sa_LGiZVrT98bXWlPA4FjVNE";"Singapore";;"June 3";"Operations Management Professional with 15 years of experience in vendor management, customer service, marketing and process management in the financial and assistance industry.   Led teams with diverse culture and background in dynamic environment.   Has implemented cross-functional projects in Fuji Xerox and AXA Assistance. An Innovator who creates value proposition solutions.";;;;;;;;;;;;;;;;;"Prudential Assurance Company Singapore";"Head, Enterprise Business Operations";"Jul 2018";"PRESENT";"- Manage the operations for Enterprise Business - Negotiate and liaise with Third Party Administrators - Work with the Corporate Sales Team for tenders and post implementation - Plan and maintain department budget - Mentor team leaders to in their personal development";"Singapore";"https://www.linkedin.com/company/prudential-assurance-company-singapore";"prudential-assurance-company-singapore";;;"Fullerton Health";"VP Operations ( Post Merger Integration)";"Jan 2018";"Jun 2018";"- Seconded to Intellicare (Philippines) to rationalise a shared services TOM by consolidating activities in the region  - Review processes for contact centre and claims processing";"Philippines";"https://www.linkedin.com/company/fullerton-health";"fullerton-health";;;"Fullerton Health";"VP Operations (MBMS)";"Aug 2016";"Dec 2017";"- Managed the Contact Centres, Claims Processing and Network Management - Ensured the delivery of services within the agreed SLA - Developed strategic / tactical plans to meet the business requirement - Planned and control the departments’ operating budget";"";"https://www.linkedin.com/company/fullerton-health";"fullerton-health";;;"Great Eastern Life";"AVP, Group Operations";"Jun 2014";"Jun 2016";"- Review processes and monitor service levels for the various entities in the S.E.A region - Ensure compliance and turnaround time as per Group policy and Regulators - Project management for new operations initiative - Strategic and resource planning for business growth";"Singapore";"https://www.linkedin.com/company/great-eastern-group";"great-eastern-group";;;"AXA Assistance";"Operations Director";"Oct 2012";"Jun 2014";"Management of International, Japanese and Malaysian Operations pertaining to the Assistance Services provided by the Company which encompasses Travel / Medical, Roadside, Home, Health and Concierge.";"Singapore";"https://www.linkedin.com/company/axa-partners";"axa-partners";;;"AXA Assistance";"Head, Claims and International Operations";"Jun 2011";"Sep 2012";"Management of International Operations  Restructuring of the Claims Department";"Singapore";"https://www.linkedin.com/company/axa-partners";"axa-partners";;;"AXA Assistance";"Head of Marketing and International Operations";"Sep 2010";"May 2011";"Management of International Operations  Realignment of business activities according to Lines of Businesses defined by the Group";"Singapore";"https://www.linkedin.com/company/axa-partners";"axa-partners";;;"University of Warwick - Warwick Business School";"Master of Business Administration - MBA";"";"";"2014";"2018";"";"University of Warwick";"Graduate Diploma in Service Leadership";"Service Leadership";"";"2010";"2012";"";"SIM University";"Diploma in Human Resource Development";"Human Resource Development";"";"2005";"2006";"";"""Management : 22, Operations Management : 13, Strategy : 13, Business Development : 12, Business Strategy : 8, Insurance : 7, Marketing Strategy : 5, Vendor Management : 5, Project Management : 4, Risk Management : 4, Procurement : 3, Account Management : 2, Project Planning : 2, Business Intelligence : 2, Sales : 2, Marketing : 2, Training : 11, Negotiation : 6, Team Leadership : 4, Customer Service : 4, New Business Development : 7, """;"";3;;"Financial Services";;;;;"Warwick Business School – University of Warwick; Synopsys Inc; Orange Business Services; Hays Executive; Abbott; MetLife"
"jamesxgz";"James Xie Guozhong";;"https://www.linkedin.com/in/jamesxgz/";"James";"Guozhong";"IT Business Analysis / Wedding Cinematography / UI Design";"https://media.licdn.com/dms/image/C5103AQHFGiU6V1eaLQ/profile-displayphoto-shrink_200_200/0?e=1577318400&v=beta&t=YWWszjWhGJfjn7kXf5NvTYjFOjUR2ZznhwhjAuDVtpc";"Singapore";;;"";;;;;;;;;;;;;;"https://vimeo.com/toheartfilms";;;"Prudential Assurance Company Singapore";"Business Analyst";"Nov 2017";"PRESENT";"";"Singapore";"https://www.linkedin.com/company/prudential-assurance-company-singapore";"prudential-assurance-company-singapore";;;"Self-managed";"Wedding Cinematographer";"2014";"PRESENT";"Artistic cinematography, Wedding AD services.";"Singapore";"https://www.linkedin.com/search/results/index/?keywords=Self-managed";;;;"National Computer Systems";"Application Consultant";"Mar 2012";"Oct 2017";"Design, develop, test and implement system modules in accordance to specifications and service level.  Manage system changes through established Change and Service Request process and";"Singapore";"https://www.linkedin.com/company/national-computer-systems";"national-computer-systems";;;"Premium Systems Technology";"Technical Specialist";"Jun 2011";"Feb 2012";"Develop and support modules for proprietary Insurance system. Data Analysis, ETL data warehousing and data transformation.";"Singapore";"https://www.linkedin.com/search/results/index/?keywords=Premium%20Systems%20Technology";;;;"Edenred";"Senior Web Designer";"Sep 2008";"May 2011";"Conceptual design, prototype and create microsites for customer-loyalty programs for channel partners Hewlett-Packard, Microsoft, Cisco, and Eu Yan Sang.";"Singapore";"https://www.linkedin.com/company/edenred";"edenred";;;;;;;;;;;;;;;;;;;;;;;"University of Wollongong";"Bachelor of Information Technology";"";"";"";"PRESENT";"";;;;;;;;;;;;;;;"""Film Production : 10, Video : 8, Cinematography : 7, """;"";3;;"Insurance";;;;;"Prudential Assurance Company Singapore; University of Wollongong; Short Film Makers; Short Film World"
"trina-neo-4451979a";"Trina Neo";;"https://www.linkedin.com/in/trina-neo-4451979a/";"Trina";"Neo";"Senior Manager, Customer Experience & Segments";"https://media.licdn.com/dms/image/C4E03AQG48T1c8NENcA/profile-displayphoto-shrink_200_200/0?e=1577318400&v=beta&t=9oIZb5nsS1_0r7JG8yxq7rd8uckrN7QAu3W3_R8DIqw";"Singapore";;"May 25";"";;;;;;;;;;;;;;;;;"Prudential Assurance Company Singapore";"Senior Manager, Customer Experience & Segments";"May 2015";"PRESENT";"";"";"https://www.linkedin.com/company/prudential-assurance-company-singapore";"prudential-assurance-company-singapore";;;"Great Eastern Life";"Integrated Marketing Communications Manager, Customer Marketing";"Aug 2010";"Apr 2015";"Job Purpose Responsible for developing and managing the suite of marketing communication and product marketing campaigns to support Life and Accident & Health business units and GE Agency channel. Coordinate the development and implementation of corporate branding campaigns for Great Eastern Singapore.";"Singapore";"https://www.linkedin.com/company/great-eastern-group";"great-eastern-group";;;"NTUC Income";"Senior Executive, Product Marketing";"Sep 2008";"Jun 2010";"Marketing Role - Involved in the development and execution of tactical marketing programs for General Insurance products - Contribute to generating sales promotional plans and calendars";"Singapore";"https://www.linkedin.com/company/income";"income";;;"MediaCorp Pte Ltd";"Senior Executive Marketing";"Apr 2006";"Sep 2008";"Marketing Role - Developing creative strategies and packaging MediaCorp TV programmes for MediaCorp TV - Develop customised and innovative marketing solutions to fulfil client’s corporate and or product communication needs";"Singapore";"https://www.linkedin.com/company/mediacorppteltd";"mediacorppteltd";;;;;;;;;;;;;;;;;;;;;;;;;;;;;;;;;"Murdoch University";"Bachelor of Commerce (B.Com.)";"Management & Marketing";"";"2002";"2003";"";;;;;;;;;;;;;;;"""Marketing Communications : 10, Marketing Strategy : 7, Digital Marketing : 6, Product Marketing : 4, Marketing Management : 2, Marketing : 1, Team Leadership : 3, Management : 3, """;"";3;;"Financial Services";;;;;"SGX; Samsung Electronics; Financial Services Marketing; Murdoch University; Eastspring Investments; Liberty Mutual Insurance"
"sadia-habeeb-cbci-aba6b976";"Sadia Habeeb , CBCI";;"https://www.linkedin.com/in/sadia-habeeb-cbci-aba6b976/";"Sadia";"Habeeb";"Business Continuity Manager at Prudential Assurance Company Singapore";"https://media.licdn.com/dms/image/C4E03AQE0Dp_u3LINvw/profile-displayphoto-shrink_200_200/0?e=1577318400&v=beta&t=1kVxbmfqK1s7E4fnkiYFLh_Fu5hqNn_LaKTUbEGtXSE";"Singapore";;;"";;;;;;;;;;;;;;;;;"Prudential Assurance Company Singapore";"Business Continuity Manager";"Jun 2018";"PRESENT";"";"Singapore";"https://www.linkedin.com/company/prudential-assurance-company-singapore";"prudential-assurance-company-singapore";;;"BNP Paribas";"Quality Assurance Manager (BCM)";"Jan 2017";"Jun 2018";"";"20 Collyer Quay";"https://www.linkedin.com/company/bnp-paribas";"bnp-paribas";;;"BNP Paribas Wealth Management";"AVP - BCM Coordintor";"May 2015";"Jan 2017";"";"";"https://www.linkedin.com/company/bnp-paribas-wealth-management";"bnp-paribas-wealth-management";;;"Barclays Bank PLC";"Service Control & Business Continuity";"Mar 2010";"May 2015";"Service Control and BCM coordinator for all Client Facing applications in Barclays Capital's Investment Banking IT division.";"";"https://www.linkedin.com/search/results/index/?keywords=Barclays%20Bank%20PLC";;;;"Nucleus Software Exports Limited";"Senior Software Quality Assurance Representative";"Jan 2003";"Aug 2009";"Achieved Capability Maturity Model Level 5 for the organization through KPMG";"";"https://www.linkedin.com/search/results/index/?keywords=Nucleus%20Software%20Exports%20Limited";;;;;;;;;;;;;;;;;;;;;;;;"The Business Continuity Institute";"Certificate of the BCI Examination (CBCI)";"Business Continuity Management";"Pass with Merit";"2016";"2016";"Achieving a Pass with Merit (92%) in the Certificate of the Business Continuity Institute (CBCI) Examination. This is an excellent achievement and confirms theoretical understanding of the principles of business continuity as defined in the BCI’s Good Practice Guidelines.";"Temasek Polytechnic";"Diploma in Information Technology";"Object Oriented Programming";"";"2000";"2003";"";;;;;;;;"""Business Continuity : 34, Software Quality Assurance : 28, Incident Management : 27, Business Analysis : 21, SDLC : 18, Configuration Management : 17, ITIL : 17, Requirements Analysis : 13, Technical Documentation : 11, Software Project Management : 11, Vendor Management : 9, Release Management : 7, Requirements Gathering : 7, Investment Banking : 6, ITIL Certified : 5, Risk Management : 4, Problem Management : 3, IT Service Management : 2, Software Development Life Cycle (SDLC) : 2, SQL : 2, Management : 2, IT Infrastructure Management : 4, Business Continuity Planning : 4, Software Configuration Management : 3, Process Improvement : 2, ISO 20000 : 1, ITIL v3 Foundations Certified : 7, """;"741";3;;"Financial Services";;;;;"Barclays Investment Bank; BNP Paribas; DBS Bank; Verizon; Barclays; Monetary Authority of Singapore (MAS)"
