"yan-sing-yeo-25b5b338";"Yan Sing Yeo";;"https://www.linkedin.com/in/yan-sing-yeo-25b5b338/";"Yan";"Yeo";"Talent & Performance Management Partner";"https://media.licdn.com/dms/image/C5603AQEfZ5Us1xHn2g/profile-displayphoto-shrink_200_200/0?e=1577318400&v=beta&t=nInDkv54qFBqJLLJQ9Ok3SpP1Lf-cdYkeWGAcbsZxkM";"Singapore";;;"";;;;;;;;;;;;;;;;;"Prudential Assurance Company Singapore";"Talent and Performance Management Partner";"Dec 2017";"PRESENT";"";"Singapore";"https://www.linkedin.com/company/prudential-assurance-company-singapore";"prudential-assurance-company-singapore";;;"SPRING Singapore";"Head, Human Capital";"Nov 2016";"Aug 2017";"";"Singapore";"https://www.linkedin.com/company/enterprisesg";"enterprisesg";;;"SPRING Singapore";"Head, Human Resources";"Apr 2016";"Oct 2016";"";"";"https://www.linkedin.com/company/enterprisesg";"enterprisesg";;;"SPRING Singapore";"Senior Manager, Human Resources & Organisation Development";"Apr 2015";"Mar 2016";"";"";"https://www.linkedin.com/company/enterprisesg";"enterprisesg";;;"SPRING Singapore";"Manager, Human Resources & Organisation Development";"Jun 2013";"Mar 2015";"SPRING Singapore is the enterprise development agency for growing innovative companies and fostering a competitive SME sector. We work with partners to help enterprises in financing, capabilities and management development, technology and innovation, and access to markets. As the national standards and accreditation body, SPRING also develops and promotes internationally-recognised standards and quality assurance to enhance competitiveness and facilitate trade.";"Singapore";"https://www.linkedin.com/company/enterprisesg";"enterprisesg";;;"Robert Walters";"Consultant";"Jul 2012";"Jun 2013";"";"Singapore";"https://www.linkedin.com/company/robert-walters";"robert-walters";;;"Bloomberg";"Human Resource Advisory";"Sep 2011";"Dec 2011";"";"Singapore";"https://www.linkedin.com/company/bloomberg-lp";"bloomberg-lp";;;"Nanyang Technological University";"Bachelors";"Business Administration (Human Resource Consulting)";"";"2008";"2010";"";"Singapore Polytechnic";"Diploma";"Banking and Finance";"";"2004";"2007";"";"International University in Germany";"";"";"";"";"PRESENT";"";"""Recruiting : 19, Executive Search : 17, Human Resources : 15, HR Consulting : 11, Talent Acquisition : 10, """;"";3;;"Financial Services";;;;;"Nanyang Technological University; The Family Office Club - #1 Largest Family Office Association | Ultra-Wealthy Wealth Management; Frazer Jones; The Recruiter.com Network - Expert Network Platform for Recruiters; Singapore Polytechnic; Human Resources (HR) & Talent Management Executive"
"anirbanbosenus";"Anirban Bose";;"https://www.linkedin.com/in/anirbanbosenus/";"Anirban";"Bose";"NUS MBA - Strategy, Operation | Digital Transformation | BI & Data Analytics | Data Science Enthusiast";"https://media.licdn.com/dms/image/C5603AQESoidSPpbFow/profile-displayphoto-shrink_200_200/0?e=1577318400&v=beta&t=zS-36Q6yEqi9OLALj5-iXxDUJnhSDz-NcdWCKGlEdk8";"Singapore";;;"Seasoned technology/business consultant with around 13 years of experience in Digital Transformation, BI & Data Analytics migration/ implementation projects in Financial Services industries across 5 countries - having a passion for result-oriented leadership, complex problem solving, developing and articulating strategic vision, building high-performance teams, supporting emerging technologies, fostering innovation, collaboration, and development of peers.   I am looking out for Product Management/Strategy/Consulting roles in tech/consulting/fintech companies where I can combine my expertise in Digital Transformation, Business Intelligence, and Data Analytics to drive value-driven strategies for the growth of the company/client.    SkillSet: •	Business/Technology Consulting (Digital/Legacy)	•	Strategic IT Risk Management	•	Design Thinking •	Value-based Stakeholder Management	•	Strategic decision making	•	End-to-end systems migration and implementation •	Pre-sales	•	Business Intelligence	•	Project management •	Business Process Re-engineering	•	Data Migration, Modelling, Reporting, and Governance	•	Agile Development   Tools and Certifications: ●	BI: Tableau (Certifications: Qualified Associate; Certified Professional); QlikView; Qlik Sense (admitted to Academic Program); IBM Cognos Report Studio; Power BI ●	Agile PM: JIRA; Confluence; HP ALM   ●	Project Management: Microsoft Project, CSM (Certified), PMP (in progress); ITIL v3 (certified)  ●	Business Analysis: Microsoft Visio  ●	Programming languages: VBA; Java; Microsoft SQL; RDBMS; R (Microsoft Certified); Python (beginner); COBOL ●	Enterprise Systems: Salesforce; PEGA Systems; EAB; Aura; Magnum; Prophet; Sun Accounting; LifeAsia, HSBC HUB ●	Languages: English (proficient), Hindi (proficient)";;;;;;;;;;;;;;;;;"Prudential Assurance Company Singapore";"Manager - Digital/Transformation/BI & Data Analytics";"Jul 2017";"PRESENT";"● Led the development of almost real-time analytics platform (Customer 360) for Customer Profiling (Net-worthiness, Fraud Detection, Business Riskiness etc.), onboading time, and acquisition costs (Won the 'Value Star' award for Collaboration, Execution excellence, and Customer Centricity). ● Led the development of first-in-class analytics platform for Point-of-sales analytics for life/health insurance - Financial Consultant 360, which is company's one-stop platform for Omnichannel Source-of-Business Profiling, Performance Metrics, Behavioral modelling, Success and Sales productivity, Product Performance. (Ist Prize for Prudential Silicon Valley Award for Innovation) ● Self-initiated project with the Data Analytics Team for migrating reports out of legacy system and automating reporting (via Qlik Sense and Power BI) based on one single data platform named Pru-Data-Hub. Currently mentoring 23-member team to support analytics requirements of Finance, Actuarial, Compliance, HR, claims in finance/actuarial modeling, compliance risk management, anti-money laundering, and subsequent C-level executive visualizations. ● Led a 9-member team of Business analysts and Developers to provide UI/UX platform solutions for NB, Finance, Actuarial, and Compliance Departments, for the One Finance Transformation. ● Led the system feasibility study and gap analysis for IFRS 17 implementation.";"Singapore";"https://www.linkedin.com/company/prudential-assurance-company-singapore";"prudential-assurance-company-singapore";;;"GE Digital";"Project Lead - Management Practicum (NUS MBA - Strategy Consulting)";"Aug 2017";"Dec 2017";"Project Objectives: ● To find out the state of Industry 4.0 in Singapore which includes market implications and transformations, key drivers, solutions and the ecosystem. It should include the key players such as government agencies, businesses (local companies and MNCs) and possibly start-ups";"Singapore";"https://www.linkedin.com/company/ge-digital";"ge-digital";;;"AXA";"Business Analyst - Digital Transformation/Business Intelligence";"Jun 2015";"Jun 2017";"● Managed vendors across 4 countries/regions and led a team of 8 people from multiple business verticals, launching Medishield Product on time with S$800k savings. ● Performed gap analysis, designed, and successfully implemented Digital Front End for Life/Health Insurance with CRM/BPM/Underwriting/Claims/Payments/BI module integrations.";"Singapore";"https://www.linkedin.com/company/axa";"axa";;;"GREAT EASTERN";"Senior Consultant - Digital";"Dec 2014";"Jun 2015";"● Led a 4-member team for BAU+ operation initiatives.";"Singapore";"https://www.linkedin.com/company/great-eastern-group";"great-eastern-group";;;"AIA";"Senior Technical Analyst";"Mar 2014";"Dec 2014";"● Led a 7-member team for the data migration activities from their existing core legacy system to the new core legacy system – writing ETL scripts, managing executive reporting (dashboards) via Qlikview, and operational reporting via XML into IBM Cognos. ● Led a 5-member team for integrating the LA core legacy systems with peripheral syste";"Singapore";"https://www.linkedin.com/company/aia";"aia";;;"CSC";"Senior Application Consultant";"Mar 2012";"Feb 2014";"● Led and coached teams of 10 people at 2 different client sites in Malaysia – Tokio Marine Life Insurance, AIA and coordinated activities between the users and team-members across Malaysia, Singapore, India, and Hong Kong. ● Handled pre-sales activities for our project bidding for AIA Malaysia/Hong Kong/Sing";"Malaysia";"https://www.linkedin.com/company/csc";"csc";;;"CSC";"Project Lead - IT";"Jun 2008";"Mar 2012";"● Project lead at 3 different client sites – Standard Chartered Bank India, Reliance Life, and India First Life. Led and coached teams of 21 people and coordinated activities between the users and team-members across 3 different cities – Mumbai, Noida, and Bangalore. Identified customer pain points in terms of TAT on customer complaints (in QlikView) and designed model to ide";"India";"https://www.linkedin.com/company/csc";"csc";;;"National University of Singapore";"Master of Business Administration (MBA)";"Strategy Specialization";"";"2016";"2018";"";"Visvesvaraya National Institute of Technology";"Bachelor of Engineering";"";"";"2001";"2005";"";"CFTE - Centre for Finance, Technology and Entrepreneurship";"AI in Finance";"";"";"2019";"2019";"";"""Enterprise Data Management : 0, Business Intelligence Tools - Qlik, Tableau, PowerBI : 0, Digital Strategy : 0, Financial Analysis : 0, Macroeconomics : 0, Digital Marketing : 0, Financial Accounting : 0, Project Management : 0, Business Intelligence : 0, Business Analysis : 0, Requirements Analysis : 0, Business Strategy : 0, Software Development Life Cycle (SDLC) : 0, Consulting : 0, Integration : 0, Business Process : 0, Strategy : 0, Business Process Management (BPM) : 0, Vendor Management : 0, Customer Relationship Management (CRM) : 0, Business Development : 0, Pre-sales : 0, Data Analytics : 0, Big Data and Strategy : 0, Business Process Automation : 0, Multicultural, Multisite Team Management : 0, Transformation Leadership : 0, Lean Transformation : 0, """;"";3;;"Financial Services";;;;;"NUS MBA Alumni and Student Connexions; Amazon; Artificial Intelligence ▶️; Jeff Weiner; National University of Singapore; Machine Learning and Data Science"
"gim-yong-eng-2a598bb4";"gim yong eng";;"https://www.linkedin.com/in/gim-yong-eng-2a598bb4/";"Gim";"Eng";"Department in Agency business and advisory standards";"data:image/gif;base64,R0lGODlhAQABAIAAAAAAAP///yH5BAEAAAAALAAAAAABAAEAAAIBRAA7";"Singapore";;;"";;;;;;;;;;;;;;;;;"Prudential Assurance Company Singapore";"Executive";"Jun 2017";"PRESENT";"";"";"https://www.linkedin.com/company/prudential-assurance-company-singapore";"prudential-assurance-company-singapore";;;"Dell";"Dell Certified Enginner";;;"";"";"https://www.linkedin.com/company/dell";"dell";;;;;;;;;;;;;;;;;;;;;;;;;;;;;;;;;;;;;;;;;;;;;;;;;;;;;"University of Wollongong";"Bachelor's degree";"Business Information System";"";"2015";"2017";"";"University of Wollongong";"Bachelor's degree";"Business Information System";"";"2015";"2017";"";;;;;;;;"""""";"";3;;"Information Technology & Services";;;;;"Prudential Assurance Company Singapore; Dell; University of Wollongong"
"samanthasee";"Samantha Terri See";;"https://www.linkedin.com/in/samanthasee/";"Samantha";"See";"Head of Customer Events, Prudential Assurance Company Singapore";"https://media.licdn.com/dms/image/C4D03AQGPLYE-0sHqPg/profile-displayphoto-shrink_200_200/0?e=1577318400&v=beta&t=Mdyrt8BLKCT323GbzXgEDXkkOqLJ1mEUIa3iaBCAgZw";"Singapore";;"August 24";"The challenge to re-think how brands can influence and connect with consumers excites me. A communication and brand professional for over 10 years, in sports and lifestyle.";;;;;;;;;;;;;;"http://facebook.com/samanthaterrisee";;;"Prudential Assurance Company Singapore";"Head of Customer Events";"Jun 2019";"PRESENT";"Creating brand experiences and content to serve and excite consumers, while enabling them with innovations to live well.";"Singapore";"https://www.linkedin.com/company/prudential-assurance-company-singapore";"prudential-assurance-company-singapore";;;"Nike";"Regional Brand Marketing Manager, Nike Women";"Sep 2015";"Jun 2019";"My role was to inspire, innovate and enable more women to do sport in Southeast Asia & India. As the leader of the Nike Women brand in this region, I created and drove a strategic vision that grew the brand and business with women, especially in emerging markets.";"Singapore";"https://www.linkedin.com/company/nike";"nike";;;"Nike";"Regional Communications Specialist";"Jul 2012";"Sep 2015";"Brand and corporate communications with media in Southeast Asia, for five business categories - Running, Football, Basketball, Women's and Sportswear. Influenced and enabled a shift of the media landscape, to create more digital platforms for Nike's stories to live on.";"Singapore";"https://www.linkedin.com/company/nike";"nike";;;"Fulford PR";"Account Manager";"Sep 2010";"Jun 2012";"Public relations strategy and execution for sports and lifestyle brands. Spearheaded social media business unit, exploring avenues and executing for clients to leverage on the then-booming platforms such as Facebook and Twitter. Kick started social media strategy for Standard Chartered Marathon Singapore.";"";"https://www.linkedin.com/company/fulford-pr";"fulford-pr";;;"LEWIS PR";"Senior Account Executive";"May 2010";"Sep 2010";"";"";"https://www.linkedin.com/company/lewis-global-communications";"lewis-global-communications";;;"Fulford PR";"Senior Account Executive";"Jan 2007";"May 2010";"Public relations account servicing for sports and lifestyle accounts. Sports: Standard Chartered Singapore Marathon, Brazilian National Team Singapore tour (2008), FINA/Arena Swimming World Cup, RBS F1 activities, and Asian Youth Games 2009. Lifestyle & Corporate: BBC Worldwide Channels Asia, Nike Sportswear, Dempsey Hill an";"";"https://www.linkedin.com/company/fulford-pr";"fulford-pr";;;;;;;;;;;;;"Squared Online";"";"Digital Marketing";"";"2017";"2018";"A digital marketing course and qualification for tomorrow’s connected leaders. Developed with Google, built by the best practitioners and delivered collaboratively online, Squared Online is the new movement in career learning. We Are Squared.";"Murdoch University";"Bachelor's Degree";"Public Relations & Communication, and Media Studies";"";"2010";"2012";"";"Management Development Institute of Singapore";"Advanced Diploma";"Mass Communications";"";"2005";"2006";"";"""Brand Management : 2, Brand Activation : 2, Media Relations : 45, Event Management : 5, Integrated Marketing : 4, Marketing Strategy : 2, Marketing Communications : 13, Marketing : 2, Public Relations : 34, Strategic Communications : 21, Sports Marketing : 10, Press Releases : 16, Corporate Communications : 13, Sports : 7, Social Media : 29, Social Media Marketing : 7, Digital Strategy : 5, Digital Marketing : 5, Account Management : 4, Crisis Communications : 2, Digital Media : 2, Internal Communications : 3, Business Development : 1, Campaign Management : 0, Client Services : 1, Press Conferences : 2, Communications Strategy : 2, Product Launches : 1, Media & Entertainment : 1, """;"551";3;;"Financial Services";;;;;"International Sports Network; Forbes; LinkedIn; Sports Marketing & Management in Qatar; Sports Industry Network; Sports Marketing and PR Pros"
"rui-bing-ong-58b56291";"Rui Bing Ong";;"https://www.linkedin.com/in/rui-bing-ong-58b56291/";"Rui";"Ong";"AML Compliance";"data:image/gif;base64,R0lGODlhAQABAIAAAAAAAP///yH5BAEAAAAALAAAAAABAAEAAAIBRAA7";"Singapore";;;"";;;;;;;;;;;;;;;;;"Prudential Assurance Company Singapore";"Compliance, Financial Crime";"Apr 2017";"PRESENT";"";"";"https://www.linkedin.com/company/prudential-assurance-company-singapore";"prudential-assurance-company-singapore";;;"J.P. Morgan";"AML Analyst, Global Compliance";"May 2015";"Mar 2017";"";"";"https://www.linkedin.com/company/j-p-morgan";"j-p-morgan";;;"DBS Bank";"AML Transaction Surveillance";"Mar 2012";"May 2015";"";"";"https://www.linkedin.com/company/dbs-bank";"dbs-bank";;;;;;;;;;;;;;;;;;;;;;;;;;;;;;;;;;;;;;;;;;;"SIM University";"Bachelor of Science (BSc)";"Marketing";"";"2012";"2015";"";;;;;;;;;;;;;;;"""AML : 4, KYC : 3, Banking : 3, Anti Money Laundering : 1, """;"";3;;"Banking";;;;;"J.P. Morgan; OCBC Bank; Monetary Authority of Singapore (MAS); United Overseas Bank Limited (UOB); Singapore University of Social Sciences (SUSS); JPMorgan Chase & Co."
"minette-mendoza-salita-54707023";"Minette Mendoza Salita";;"https://www.linkedin.com/in/minette-mendoza-salita-54707023/";"Minette";"Salita";"Experienced Accounting Professional and Licensed Financial Consultant in Singapore.";"data:image/gif;base64,R0lGODlhAQABAIAAAAAAAP///yH5BAEAAAAALAAAAAABAAEAAAIBRAA7";"Singapore";;;"";;;;;;;;;;;;;;;;;"HP";"Executive Assistant";"Nov 2015";"PRESENT";"";"Singapore";"https://www.linkedin.com/company/hp";"hp";;;"Prudential Assurance Company (Singapore) Pte Ltd";"Financial Consultant";;;"";"";"https://www.linkedin.com/search/results/index/?keywords=Prudential%20Assurance%20Company%20(Singapore)%20Pte%20Ltd";;;;;;;;;;;;;;;;;;;;;;;;;;;;;;;;;;;;;;;;;;;;;;;;;;;;;;"Polytechnic University of the Philippines";"Bachelor";"Accountancy";"";"";"PRESENT";"";;;;;;;;;;;;;;;"""Big Data : 0, Machine Learning : 0, """;"";3;;"Information Technology & Services";;;;;"Polytechnic University of the Philippines; HP"
"carlos-amparo-35b99bb1";"Carlos Amparo";;"https://www.linkedin.com/in/carlos-amparo-35b99bb1/";"Carlos";"Amparo";"Financial Services Consultant";"https://media.licdn.com/dms/image/C5103AQHOPWZmq0Bt7g/profile-displayphoto-shrink_200_200/0?e=1577318400&v=beta&t=pwLVKwkdEB1iIjMh8UMUkEvJVB3QZibauWb9iOQaRo0";"Singapore";;"September 18";"Life Insurance is how far a man is willing to go to protect his family by making a promise. I don't help people protect their family, I simply get to be part of it.   “A big part of Financial Freedom is having Your Heart and Mind Free from Worry about the what-ifs of Life”  - Suze Orman";;;;;;;;;;;;;;;;;"Prudential Assurance Company Singapore";"Financial Services Consultant";"Dec 2018";"PRESENT";"";"Singapore";"https://www.linkedin.com/company/prudential-assurance-company-singapore";"prudential-assurance-company-singapore";;;"AIA";"Financial Services Consultant";"May 2018";"Dec 2018";"";"";"https://www.linkedin.com/company/aia";"aia";;;"A*STAR - Agency for Science, Technology and Research";"Intern";"Mar 2016";"Aug 2016";"Testing of Effectivity of Novel Drugs on Cancer Cells on Cell Phase Arrest";"bouna vista";"https://www.linkedin.com/company/a-star";"a-star";;;;;;;;;;;;;;;;;;;;;;;;;;;;;;;;;;;;;;;;;;;"Republic Polytechnic";"High School Diploma";"Biotechnology";"";"2014";"2017";"";"Fuchun Secondary";"Secondary School";"Biology/Biological Sciences, General";"";"2011";"2013";"";"Tenby International School";"Primary School";"Biology/Biological Sciences, General";"";"2004";"2010";"";"""Insurance : 3, Risk Management : 3, Financial Analysis : 2, Life Insurance : 0, Health Insurance : 0, General Insurance : 0, """;"";3;;"Financial Services";;;;;"Amazon; Tony Robbins; Forbes; Schroders; Bill Gates; Monetary Authority of Singapore (MAS)"
"lilianchew";"Lilian Chew";;"https://www.linkedin.com/in/lilianchew/";"Lilian";"Chew";"Master Financial Consultant at Prudential Assurance Company Singapore";"https://media.licdn.com/dms/image/C4D03AQEQnEE7bnHlXA/profile-displayphoto-shrink_200_200/0?e=1577318400&v=beta&t=nO3Q-5nlIJWRiVxGjRSd8VzcOuKa7L8WzAMwoSV4SU0";"Singapore";;;"Excellent track record in client financial portfolio planning and wealth management.  Passionate about making a difference to individuals, families and businesses through assisting them achieve their financial goals. -	Solutions dedicated to protect loved ones, safeguard assets, build nest egg and grow wealth. -	Expert in risk profiling, legacy planning, asset diversification and asset protection. -	Focus on relationships built on trust & discretion for long term.  Specialisation: For you and your loved ones: - Insurance, Income protection & Risk management - Investment/Wealth accumulation and Wealth preservation  - Education & Retirement planning  - Wealth distribution and Legacy plans - Trust and nomination of beneficiary services  For your business: - Keyman protection & business continuity plans - Group insurance and Employee benefits";;;;;;;;;;;;;;;;;"Prudential Assurance Company Singapore";"Master Financial Consultant";"May 2019";"PRESENT";"";"";"https://www.linkedin.com/company/prudential-assurance-company-singapore";"prudential-assurance-company-singapore";;;"Prudential Assurance Company Singapore";"Private Wealth Consultant, OPUS by Prudential";"Apr 2017";"PRESENT";"Achievements: MDRT, Premier Adviser Star Club Premier - 2019, 2018, 2017, 2016, 2015, 2014 Quality Club Elite - 2019, 2018, 2017, 2016, 2015, 2014";"Singapore";"https://www.linkedin.com/company/prudential-assurance-company-singapore";"prudential-assurance-company-singapore";;;"Prudential Assurance Company Singapore";"Senior Financial Consultant and Wealth Manager";"Apr 2015";"Mar 2017";"";"Singapore";"https://www.linkedin.com/company/prudential-assurance-company-singapore";"prudential-assurance-company-singapore";;;"Prudential Assurance Company Singapore";"Financial Consultant";"2013";"Mar 2015";"With more than 17 years of accumulated experiences in finance, I now maximise my skills and knowledge in providing personalised financial advisory to individuals and businesses.  I am committed to taking care of my clients financial needs & financial security by rende";"Singapore";"https://www.linkedin.com/company/prudential-assurance-company-singapore";"prudential-assurance-company-singapore";;;"Procter & Gamble";"Group Finance Manager";"1995";"2012";"Senior finance leader with over 17 years in various management, business and functional leadership roles. Regional experience and responsibilities in both developed and developing markets.  Proven track record in delivering superior financial results, project management, busines";"";"https://www.linkedin.com/company/procter-and-gamble";"procter-and-gamble";;;"PwC";"Senior Auditor";"1996";"1997";"";"";"https://www.linkedin.com/company/pwc";"pwc";;;;;;;;;;;;;"UNIVERSITY OF NEW SOUTH WALES, SYDNEY, AUSTRALIA";"Bachelor of Commerce - Finance (Banking) and Accounting (Merit)";"";"";"1991";"1993";"";;;;;;;;;;;;;;;"""Financial Analysis : 21, FMCG : 16, Business Strategy : 12, Financial Modeling : 8, Financial Planning : 7, Forecasting : 5, Portfolio Management : 4, Risk Management : 4, Strategic Financial Planning : 4, Project Management : 4, Consumer Products : 4, Wealth Management : 3, Financial Reporting : 3, Retirement Planning : 2, Financial Audits : 2, Insurance : 1, Business Analysis : 1, Financial Forecasting : 1, Investment Management : 0, Estate Planning : 0, Management : 5, Personal Financial Planning : 0, Income Protection : 0, Intergenerational Wealth Transfer : 0, """;"554";3;;"Financial Services";;;;;"Prudential Assurance Company Singapore; Prudential Corporation Asia; The Wall Street Journal; PrimeTime Business and Professional Women's Association; Chip Bergh; P&G Alumni Network - Global (Procter & Gamble)"
"jenny-lee-5b57b151";"Jenny Lee";;"https://www.linkedin.com/in/jenny-lee-5b57b151/";"Jenny";"Lee";"Compliance Manager at Prudential Assurance Company Singapore";"https://media.licdn.com/dms/image/C5103AQFhFXF6QZq9SA/profile-displayphoto-shrink_200_200/0?e=1577318400&v=beta&t=D1XUMgBqKhzLnROlwETOuOnomG6S-WjTOlCpVOAiTyk";"Singapore";;;"";;;;;;;;;;;;;;;;;"Prudential Assurance Company Singapore";"Compliance Manager (Advisory, Regulatory & Engagement)";"2008";"PRESENT";"";"";"https://www.linkedin.com/company/prudential-assurance-company-singapore";"prudential-assurance-company-singapore";;;"Mercer";"Claims Analyst";"2005";"2008";"";"";"https://www.linkedin.com/company/mercer";"mercer";;;"AIA";"Assistant Manager";"2001";"2005";"";"";"https://www.linkedin.com/company/aia";"aia";;;;;;;;;;;;;;;;;;;;;;;;;;;;;;;;;;;;;;;;;;;"National University of Singapore";"";"";"";"1998";"2001";"";"Temasek Junior College";"";"";"";"1996";"1997";"";;;;;;;;"""Claims : 0, Underwriting : 0, Microsoft Office : 0, Chartered Financial Consultant : 0, Customer Service : 0, Policy Services : 0, """;"";3;;"Financial Services";;;;;"Singapore Compliance Practitioners; Prudential Assurance Company Singapore; National University of Singapore; Temasek Junior College"
"hui-yi-tay-56ba6873";"Hui Yi Tay";;"https://www.linkedin.com/in/hui-yi-tay-56ba6873/";"Hui";"Tay";"Financial Consultant";"data:image/gif;base64,R0lGODlhAQABAIAAAAAAAP///yH5BAEAAAAALAAAAAABAAEAAAIBRAA7";"Singapore";;;"";;;;;;;;;;;;;;;;;"Prudential Assurance Company Singapore";"Financial Consultant";"Aug 2016";"PRESENT";"";"Singapore";"https://www.linkedin.com/company/prudential-assurance-company-singapore";"prudential-assurance-company-singapore";;;"Great American Insurance Group";"Hull Underwriting Intern";"Nov 2015";"Dec 2015";"";"Singapore";"https://www.linkedin.com/company/great-american-insurance";"great-american-insurance";;;"QBE Insurance";"Temporary Hull Underwriting Executive";"Oct 2013";"Jun 2014";"";"Singapore";"https://www.linkedin.com/company/qbe";"qbe";;;"Mandarin Orchard Singapore";"Management Trainee";"Mar 2012";"Sep 2013";"";"Singapore";"https://www.linkedin.com/company/mandarinorchardsingapore";"mandarinorchardsingapore";;;;;;;;;;;;;;;;;;;;;;;;;;;;;;;;;"RMIT University";"Bachelor of Business";"Economics and Finance";"";"2014";"2016";"";"Republic Polytechnic";"Diploma in Customer Relationship and Service Management";"Hospitality Administration/Management";"";"2009";"2012";"";;;;;;;;"""English : 2, Chinese : 1, """;"";3;;"Financial Services";;;;;"William De Vijlder; Republic Polytechnic; Louis Vuitton; Prudential Assurance Company Singapore; PwC Singapore; RMIT University"
