"id";"Full name";"Email";"Profile url";"First name";"Last name";"Title";"Avatar";"Location";"Address";"Birthday";"Summary";"Twitter";"Phone 1";"Phone 1 type";"Phone 2";"Phone 2 type";"Phone 3";"Phone 3 type";"Messenger 1";"Messenger 1 type";"Messenger 2";"Messenger 2 type";"Messenger 3";"Messenger 3 type";"Website 1";"Website 2";"Website 3";"Organization 1";"Organization Title 1";"Organization Start 1";"Organization End 1";"Organization Description 1";"Organization Location 1";"Organization LI URL 1";"Organization LI ID 1";"Organization WWW 1";"Organization Domain 1";"Organization 2";"Organization Title 2";"Organization Start 2";"Organization End 2";"Organization Description 2";"Organization Location 2";"Organization LI URL 2";"Organization LI ID 2";"Organization WWW 2";"Organization Domain 2";"Organization 3";"Organization Title 3";"Organization Start 3";"Organization End 3";"Organization Description 3";"Organization Location 3";"Organization LI URL 3";"Organization LI ID 3";"Organization WWW 3";"Organization Domain 3";"Organization 4";"Organization Title 4";"Organization Start 4";"Organization End 4";"Organization Description 4";"Organization Location 4";"Organization LI URL 4";"Organization LI ID 4";"Organization WWW 4";"Organization Domain 4";"Organization 5";"Organization Title 5";"Organization Start 5";"Organization End 5";"Organization Description 5";"Organization Location 5";"Organization LI URL 5";"Organization LI ID 5";"Organization WWW 5";"Organization Domain 5";"Organization 6";"Organization Title 6";"Organization Start 6";"Organization End 6";"Organization Description 6";"Organization Location 6";"Organization LI URL 6";"Organization LI ID 6";"Organization WWW 6";"Organization Domain 6";"Organization 7";"Organization Title 7";"Organization Start 7";"Organization End 7";"Organization Description 7";"Organization Location 7";"Organization LI URL 7";"Organization LI ID 7";"Organization WWW 7";"Organization Domain 7";"Education 1";"Education Degree 1";"Education FOS 1";"Education Grade 1";"Education Start 1";"Education End 1";"Education Description 1";"Education 2";"Education Degree 2";"Education FOS 2";"Education Grade 2";"Education Start 2";"Education End 2";"Education Description 2";"Education 3";"Education Degree 3";"Education FOS 3";"Education Grade 3";"Education Start 3";"Education End 3";"Education Description 3";"Skills";"Followers";"Relationship";"Connected at";"Industry";"Mutual Count";"Mutual";"Mutual 1";"Mutual 2";"Interests"
"lionelngzeji";"Lionel Ng";"lionelngzeji@gmail.com";"https://www.linkedin.com/in/lionelngzeji/";"Lionel";"Ng";"President at Ellipsis SMU Information Systems Society";"https://media.licdn.com/dms/image/C5603AQHb-3BQiFKgog/profile-displayphoto-shrink_200_200/0?e=1576713600&v=beta&t=Z81CTyupqmn9hyuUu8uonwTMJNQnCLMaoPETz9ebyA4";"Singapore";;;"A Penultimate Information Systems Undergraduate at Singapore Management University with multiple student leadership experiences and work experience in the Public and Financial Services Sector.  Being a driven person and a tech enthusiast, I have a keen interest in interacting with other Tech professionals to learn and exchange ideas with others. In my free time, I enjoy a good game of Basketball/Poker or exploring the world of technology through external courses and meetups.  Please feel free to get in touch, I am always up for a good cup of coffee!";;"+6593251929";"Mobile";;;;;;;;;;;;;;"Ellipsis SMU Information Systems Society";"President";"Jan 2019";"PRESENT";"The SMU Information Systems Society (Ellipsis) is the student body that represents the SMU School of Information Systems. Ellipsis aims to serve and care for our community with initiatives that focus on engagement, holistic development and fostering a shared sense of identity.";"";"https://www.linkedin.com/company/ellipsis-smu-information-systems-society";"ellipsis-smu-information-systems-society";;;"Singapore Management University";"Teaching Assistant";"Aug 2018";"PRESENT";"• Teaching Assistant for IS110: Information Systems & Innovation & IS210: Business Process Analysis & Solutioning • Selected to be part of the Course Teaching team for achieving academic excellence and displaying strong domain knowledge in Process Modelling & IT Strategy";"";"https://www.linkedin.com/company/singapore-management-university";"singapore-management-university";;;"Prudential Assurance Company Singapore";"Financial Consultant";"Jun 2017";"PRESENT";"• Awarded the Fast Track Qualifier award for achieving outstanding sales production within 6 months • Provide financial advisory services in life and health insurance products for potential client • Conduct portfolio review, financial needs analysis and financial products recommendat";"";"https://www.linkedin.com/company/prudential-assurance-company-singapore";"prudential-assurance-company-singapore";;;"JTC Corporation";"Data Engineer Intern";"May 2019";"Aug 2019";"• Assisted in maintaining quality transaction data by performing operations such as cleaning, transformation using Python scripts and Pandas framework to ensure the integrity of the data in a relational environment • Designed and prepared an interactive dashboard using PowerBI to analyse the critical";"Singapore";"https://www.linkedin.com/company/jtc-corporation";"jtc-corporation";;;"FinLoft Bangkok";"Technology & Operations Intern";"Apr 2019";"May 2019";"• Worked in a team of 5 to deliver company, competitor and industry analysis for the Australia and Bangkok market • Proposed and implemented new site content and web interface for the company’s website which improved the user experience for accommodation booking and information sharing";"Bangkok, Thailand";"https://www.linkedin.com/search/results/index/?keywords=FinLoft%20Bangkok";;;;;;;;;;;;;;;;;;;;;;;;"Singapore Management University";"Bachelor of Science - BS";"Information Systems (Business Analytics with 2nd Major in Digital Business Solutioning)";"";"2017";"2021";"• Recipient of Jian Li Study Award 2018 • Nominated to participate in IMDA's Industry Preparation for Pre-graduate (iPREP) Programme";"Anderson Junior College";"";"GCE A Levels";"";"2013";"2014";"• Recipient of AJC Outstanding Leadership Award 2014";"Nan Hua High School";"";"GCE O Levels";"";"2009";"2012";"• Recipient of NHHS Top CCA Performer Award (2012)• Recipient of Edusave Award for Achievement, Good Leadership AND Service (EAGLES)• Recipient of National Youth Achievement Award (SIlver)• Recipient of Character Quest competition (Gold)";"""Leadership : 6, Personal Financial Planning : 2, Programming : 2, Sales : 1, Web Development : 0, PHP : 0, Python : 0, MySQL : 0, HTML : 1, Cascading Style Sheets (CSS) : 0, JavaScript : 0, """;"469";1;"January 20, 2019";"Information Technology & Services";105;"Aaron Sim, Sean Wei";"Aaron Sim";"Sean Wei";"Deloitte; IBM; J.P. Morgan; PwC; Accenture; Oracle"
"jason-tanghx";"Jason Tang";"jasontanghanxiang@gmail.com";"https://www.linkedin.com/in/jason-tanghx/";"Jason";"Tang";"Financial Service Consultant at Prudential Assurance Company Singapore";"https://media.licdn.com/dms/image/C5103AQG-WUr24Xz9wA/profile-displayphoto-shrink_200_200/0?e=1576713600&v=beta&t=S8rCrLu5lGjqi5kTN-uk7FM8VOq3w6-6ItPKOY5cKk4";"Singapore";;"February 7";"Passionate in the Financial Services Industry. Studies Actuarial Science to further complement expertise in delivering a strong portfolio for my clients. Strong believer of giving more than receiving. Family, Friends & Clients First. Spends free time reading. Always love to end my day with a workout in the gym.  ""Make mistakes. Learn from them. Move on.""";;;;;;;;;;;;;;"https://www.instagram.com/jasontanghx/?hl=en";;;"Prudential Assurance Company Singapore";"Financial Service Consultant";"Jul 2017";"PRESENT";"";"";"https://www.linkedin.com/company/prudential-assurance-company-singapore";"prudential-assurance-company-singapore";;;"William Tan Organisation";"Financial Services Consultant";"Jul 2017";"PRESENT";"";"";"https://www.linkedin.com/company/william-tan-organisation";"william-tan-organisation";;;"Sport Singapore";"Lifeguard";"Feb 2016";"Jul 2016";"";"";"https://www.linkedin.com/company/sportsingapore";"sportsingapore";;;"Singapore Armed Forces (SAF)";"Naval Diver";"Mar 2014";"Jan 2016";"";"";"https://www.linkedin.com/company/singapore-armed-forces-saf";"singapore-armed-forces-saf";;;;;;;;;;;;;;;;;;;;;;;;;;;;;;;;;"Nanyang Technological University";"Bachelor of Business";"Actuarial Science";"";"2016";"2020";"";"Serangoon junior college";"";"";"Top in cohort for H2 Mathematics in 1st year of studies";"2012";"2013";"";;;;;;;;"""Investments : 11, Financial Planning : 11, Insurance : 10, Life Insurance : 6, Risk Management : 6, Health Insurance : 6, Finance : 5, Event Planning : 4, """;"10154";2;;"Financial Services";56;"Koh Rui Xia Lynn, Jin Qiang GOH";"Koh Xia Lynn";"Jin Qiang";"Nanyang Technological University; Prudential Assurance Company Singapore; William Tan Organisation; Chih Ching Ong; WTO; MDRT"
"wen-xiang-tang-6a2751175";"Wen Xiang Tang";;"https://www.linkedin.com/in/wen-xiang-tang-6a2751175/";"Wen";"Tang";"#HelpServeEducate";"https://media.licdn.com/dms/image/C5103AQHzstvo5-oosQ/profile-displayphoto-shrink_200_200/0?e=1576713600&v=beta&t=14TbvqjHwpprhDHJnGG21IqeyaQ-kPn3ppstsfCQcvQ";"Singapore";;;"Empowering individuals towards a brighter future through servicing their needs and personal education.";;;;;;;;;;;;;;;;;"Prudential Assurance Company Singapore";"Financial Services Consultant";"Jul 2016";"PRESENT";"";"";"https://www.linkedin.com/company/prudential-assurance-company-singapore";"prudential-assurance-company-singapore";;;"Nanyang Technological University";"Student";"Aug 2015";"PRESENT";"";"Singapore";"https://www.linkedin.com/company/ntusg";"ntusg";;;"Resorts World Sentosa";"Tour Guide";"Mar 2012";"Jun 2013";"";"Singapore";"https://www.linkedin.com/company/resorts-world-sentosa";"resorts-world-sentosa";;;;;;;;;;;;;;;;;;;;;;;;;;;;;;;;;;;;;;;;;;;"Nanyang Technological University";"Bachelor of Arts (Honors) in Public Policy and Global Affairs";"Public Policy & Global Affairs";"Honours (Distinction)";"2015";"2019";"";"Nanyang Polytechnic";"Diploma in Hospitality and Tourism Management with Merit";"Hospitality Administration/Management";"Diploma with Merit";"2010";"2013";"";;;;;;;;"""Microsoft PowerPoint : 2, Microsoft Office : 1, Customer Service : 1, Project Management : 1, Management : 1, Leadership : 1, """;"1516";2;;"Financial Services";51;"Yi Shiun Tan, Aaron Sim";"Yi Tan";"Aaron Sim";"Apple; Nanyang Technological University; Google; National University of Singapore; Richard Branson; Ministry of Manpower"
"cherietanjy";"Cherie T.";;"https://www.linkedin.com/in/cherietanjy/";"Cherie";"T.";"Wealth Planner for Women & HNW ♡ Wealth Planner (AWP), Mortgage Planner";"https://media.licdn.com/dms/image/C5103AQGlNqe-3Zh7Hg/profile-displayphoto-shrink_200_200/0?e=1576713600&v=beta&t=pYga83IWonW-HI3ohN9Ee_0F-IYlUijRRQCK0Jx9Ytw";"Singapore";;;"Life is filled with fleeting moments and with that comes the need to make serious financial decisions and commitments that may not always benefit you in both the long and short term. As an Associate Wealth Planner (AWP) and Financial Consultant in Prudential Assurance (Singapore), I work together with my clients to come up with financial plans that review the past, safeguard their present, and protect their future.  I have a strong passion for focusing on my clients’ goals and concerns, and providing customized and personalized solutions to help create a strategy for their financial security. Whether it is funding for education or retirement, helping protect those you love, or planning to pass on your estate or business, I am committed to advising clients on ways to help them achieve their financial goals.  I work with a team of experienced professionals that assist in investment and insurance solutions for my clients. My goal is to ensure that each of my clients receives the most personal and satisfactory service I can provide, so they may create, accumulate and preserve wealth and achieve their dreams.  🔴 Disclaimer: prudential.com.sg/FC-info  In the early years of my career, I was heavily involved in designing beautiful web interfaces, product design and marketing solutions for over 100 companies, startups, and individuals. Today, I remain a Managing Director of my firm, Mogul Tech International. We are a Software Design and Software Solutions company based in Singapore.  Through my work in technology and design, I was also featured in the following publications: - HuffPost '18 (Limit-Breaking Female Founders) - Reader's Digest '18 (Millennials Who Made A Fortune) - Women2.0 '17 (How I Turn From a 14-Year-Old Freelancer to Tech CEO) - Digital Nomad Girls '17 (Digital Nomads)";"cherietanjy";;;;;;;;;;;;;"https://fpas.org.sg/users/jie-ying-tan/";"http://cherietan.com";;"Prudential Assurance Company Singapore";"Associate Wealth Planner (AWP) and Financial Consultant";"Apr 2018";"PRESENT";"Life is filled with fleeting moments and with that comes the need to make serious financial decisions and commitments that may not always benefit you in both the long and short term. As an Associate Wealth Planner (AWP) and Financial Consultant in Prudential Assurance (Singapore), I work together with my clients to come up with financial plans that review the past, safeguard their present, and protect their future.  My areas of expertise include: * Retirement Planning (Singapore) * Investment Planning * Financial Planning (with a core focus in helping women and mothers achieve financial protection and success) * Wealth Planning (high net worth)  On-going education in the field of financial planning adds value to both my clients and myself. As a certified Associate Wealth Planner (AWP) and a member of the Financial Planning Associate of Singapore (FPAS), I am continuing my education to achieve various education accolades such as the Certified Financial Planner (CFP) credential — the most desired and respected global certification for those seeking to demonstrate their commitment to competent and ethical financial planning practice.  Prudential Assurance Company: Prudential Assurance Company (Singapore) has been serving the financial and protection needs of Singaporeans for over 85 years. Prudential Assurance Company (Singapore) is an indirect wholly-owned subsidiary of UK-based Prudential plc, is one of the top life insurance companies in Singapore. We have been serving the financial and protection needs of Singaporeans for over 85 years. Our focus is to bring well-rounded financial solutions to customers through our multi-channel distribution network, with product offerings in Protection, Savings and Investment. We are one of the market leaders in Protection, Savings and Investment-linked plans with S$31.5 billion funds under management as at 31 December 2016. We have an AA- Financial Strength Rating awarded by leading credit rating agency Standard & Poor’s.";"Singapore";"https://www.linkedin.com/company/prudential-assurance-company-singapore";"prudential-assurance-company-singapore";;;"Mogul Tech International";"Managing Director";"Dec 2015";"Jan 2019";"Mogul Tech International is a software design and software solutions firm, delivering innovative and thoughtful UXUI solutions to startups, entrepreneurs and enterprises worldwide.";"Singapore";"https://www.linkedin.com/company/mogul-tech-international";"mogul-tech-international";;;;;;;;;;;;;;;;;;;;;;;;;;;;;;;;;;;;;;;;;;;;;;;;;;;;;"University of Newcastle-upon-Tyne";"Chemical Engineering";"";"2nd Upper (Hons)";"2013";"2015";"◆ Vice President of Newcastle University Chemical Engineering Society (NUCES)◆ Newcastle University Ambassador◆ Newcastle University Mentor";"BrainStation";"Web Development Full Time";"Web Development";"";"2015";"2015";"A fantastic course that built on my front-end and back-end skills, particularly in healthy code architecture.";"Digital Marketing Institute";"Professional Diploma in Digital Marketing";"Marketing";"";"2014";"2015";"◆ Implementation of social media strategies and sustaining of customer relationship.◆ Effective evaluation of budget and expenditure against initial campaign goals. ◆ Development of clear and coherent digital marketing plans.";"""Management : 27, Entrepreneurship : 18, Customer Relationship Management (CRM) : 10, Social Media Marketing : 13, Web Development : 11, CRM : 6, SEO : 3, Social Media : 13, Digital Marketing : 9, Search Engine Optimization (SEO) : 4, Ruby on Rails : 7, Matlab : 6, WordPress : 6, JavaScript : 5, jQuery : 4, Google Analytics : 4, Microsoft Office : 8, Leadership : 17, """;"4030";2;;"Financial Services";33;"Syukri Rahiman, Shawn Lee";"Syukri Rahiman";"Shawn Lee";"On Startups - The Community For Entrepreneurs; Mark Cuban; Richard Branson; United Overseas Bank Limited (UOB); Prudential Assurance Company Singapore; The Accidental Product Manager"
"nurisirfan";"Nuris Irfan";;"https://www.linkedin.com/in/nurisirfan/";"Nuris";"Irfan";"Corporate Actuarial (Reinsurance) Trainee at Prudential Assurance Company Singapore";"https://media.licdn.com/dms/image/C5103AQHoZ0cNEIfGdw/profile-displayphoto-shrink_200_200/0?e=1576713600&v=beta&t=hKhFSi0taG1sD0AmKVfGCBKs_MJqx9mpvQXV1KAAN34";"Singapore";;;"Hello, thank you for reading! I am an undergrad from the SMU School of Economics with a second major in Actuarial Science expecting to graduate in December 2021. I am the Honorary General Secretary of the SMU Actuarial Science Club and an active player for the SMU Rugby team. Aside from this, I did volunteering with SMU Kidleidoscope and SMU Starring whilst maintaining a credible GPA.  I have had experience in life product pricing and the group reporting & performance management side of valuation. Driven and with a passion for continuous learning, I am an aspiring actuarial analyst and am looking to develop myself more in this field. Please feel free to contact me  for job opportunities at nurisirfan.2017@smu.edu.sg";;;;;;;;;;;;;;;;;"Prudential Assurance Company Singapore";"Corporate Actuarial (Reinsurance) Trainee";"Aug 2019";"PRESENT";"";"";"https://www.linkedin.com/company/prudential-assurance-company-singapore";"prudential-assurance-company-singapore";;;"AXA";"Valuation Intern (Actuarial)";"May 2019";"Jul 2019";"Group Reporting & Performance Management";"Singapore";"https://www.linkedin.com/company/axa";"axa";;;"Manulife";"Product Pricing Intern (Actuarial)";"Jan 2019";"Apr 2019";"• Carried out BI-AXIS matching for ReadyLife Income to ensure generation of BIs from multiple sources would tally. • Carried out Mass User Testing for both Par and Non-par products. • Created yield monitoring reports for Single Premium Endowments.";"Singapore";"https://www.linkedin.com/company/manulife-financial";"manulife-financial";;;;;;;;;;;;;;;;;;;;;;;;;;;;;;;;;;;;;;;;;;;"Singapore Management University";"BSc";"Economics and Second Major in Actuarial Science";"";"2017";"2021";"• MERCU-SMU Excellence Scholar• Lim Boon Heng Book Scholar• Two- time Jurong Spring Education Award Receipient• Rugby player & Actuarial Science Club Honorary General Secretary• Distinctions in Statistical Theory, Applied Econometrics, Ethics & Social Responsibility and more.";"Catholic JC";"'A' Levels";"Chemistry, Economics, Mathematics, Physics";"";"2013";"2014";"Class ChairmanRugby Executive CommitteeLeadership Camp Executive CommitteeService Learning Project Leader";;;;;;;;"""Economics : 6, Management : 5, Leadership : 5, Financial Accounting : 2, Microsoft Excel : 3, Microsoft Office : 1, R : 0, SQL : 0, Python : 0, Excel : 0, Applied Econometrics : 1, Statistical Theory : 1, """;"";2;;"Financial Services";21;"Nicole Chai, Wong ZhenYi, Nicholas";"Nicole Chai";"Wong Zhenyi";"SMU Actuarial Science Alumni; HSBC; EY; LinkedIn; McKinsey & Company; J.P. Morgan"
"tate-quek-224bb8185";"Tate Quek";;"https://www.linkedin.com/in/tate-quek-224bb8185/";"Tate";"Quek";"Human Resources Executive at Prudential Financial";"https://media.licdn.com/dms/image/C5103AQFj3BJOd0Na7w/profile-displayphoto-shrink_200_200/0?e=1576713600&v=beta&t=dAxsaiWmRUMcpf-qH-j49KMb_37YOULaa5yajKEN3yU";"Singapore";;;"Prudential is one of the top life insurance companies in Singapore which has been serving the financial and protection needs of Singaporeans for over 85 years. Since 2017, Prudential has been one of the market leaders in Protection, Savings and Investment-linked plans. It stands as Singapore's only life insurer awarded with the AA Financial Strength Rating by leading credit rating agency Standard & Poor’s.  If you are an aspiring individual looking to explore how Prudential can help you grow and steer towards a fulfilling career, feel free to get in touch with me on LinkedIn.";;;;;;;;;;;;;;;;;"Prudential Assurance Company Singapore";"Human Resources Executive";"Apr 2019";"PRESENT";"";"Singapore";"https://www.linkedin.com/company/prudential-assurance-company-singapore";"prudential-assurance-company-singapore";;;"Singapore Armed Forces (SAF)";"Naval Officer";"Feb 2018";"Feb 2019";"";"";"https://www.linkedin.com/company/singapore-armed-forces-saf";"singapore-armed-forces-saf";;;;;;;;;;;;;;;;;;;;;;;;;;;;;;;;;;;;;;;;;;;;;;;;;;;;;"National University of Singapore";"Psychology";"";"";"2019";"2023";"• NUS Global Merit Scholarship";"Temasek Junior College";"A' Levels";"";"Physics, Chemistry, Mathematics, Economics";"2016";"2017";"• Outdoor Adventure Club EXCO• DEFY Camp Organizer• TJC Innovation Award";"Anglican High School";"O'Levels";"";"";"2012";"2015";"• President of Concert Band• Outstanding Student Leader Award• Moo Soon Chong Student Leadership Award• National Youth Achievement Award - Bronze Medal";"""Team Management : 1, Microsoft Office : 1, Team Leadership : 1, Creative Problem Solving : 1, Public Speaking : 1, """;"";2;;"Financial Services";36;"Zhi Wei Chin, Koh Rui Xia Lynn";"Zhi Chin";"Koh Xia Lynn";"Prudential Assurance Company Singapore; National University of Singapore; Prudential Financial; Temasek Junior College"
