"damien-chiang-86b6a96b";"Damien Chiang";;"https://www.linkedin.com/in/damien-chiang-86b6a96b/";"Damien";"Chiang";"Financial Services Consultant at Prudential Assurance Company Singapore";"https://media.licdn.com/dms/image/C5603AQGK13Gy1knEJQ/profile-displayphoto-shrink_200_200/0?e=1576713600&v=beta&t=w4gPdggIpbzHjUf5O0gbMIpFou4MmO9vswISARapKak";"Singapore";;;"As the saying goes, ""There is no elevator to success. You have to take the stairs."" - Zig Ziglar";;;;;;;;;;;;;;;;;"Prudential Assurance Company Singapore";"Financial Services Consultant";"Oct 2019";"PRESENT";"";"Singapore";"https://www.linkedin.com/company/prudential-assurance-company-singapore";"prudential-assurance-company-singapore";;;"Marriott International";"Asset Management Intern";"Jun 2018";"Dec 2018";"";"Singapore";"https://www.linkedin.com/company/marriott-international";"marriott-international";;;"Gates Corporation";"Finance Intern";"Jun 2017";"Nov 2017";"";"Singapore";"https://www.linkedin.com/company/gates-corporation";"gates-corporation";;;"Singapore Armed Forces (SAF)";"Specialist";"Sep 2013";"Aug 2015";"Civil Military Relations at HQ Guards";"Singapore";"https://www.linkedin.com/company/singapore-armed-forces-saf";"singapore-armed-forces-saf";;;"Spa Esprit Group";"Database Administrator";"May 2013";"Aug 2013";"";"Singapore";"https://www.linkedin.com/company/spa-esprit-group";"spa-esprit-group";;;"Resorts World Sentosa";"Project Development Intern";"Mar 2012";"Aug 2012";"";"Singapore";"https://www.linkedin.com/company/resorts-world-sentosa";"resorts-world-sentosa";;;;;;;;;;;;;"Nanyang Technological University";"Bachelor of Business (Honours)";"Banking and Finance";"";"2015";"2019";"";"The Hong Kong Polytechnic University";"Bachelor of Business Administration - BBA";"Banking and Financial Support Services";"";"2018";"2018";"NTU Gem Explorer Spring Exchange Programme AY17/18 Sem 2Academic courses taken: Derivative Securities, Fixed Income Securities, Strategic Management, International Business Environment, Management & Organisation, Cultural Intelligence";"Ngee Ann Polytechnic";"Diploma in Tourism & Resort Management";"";"3.67 out of 4.00";"2010";"2013";"";"""Microsoft Excel : 0, Microsoft Word : 0, Microsoft PowerPoint : 0, Trading : 0, Visual Basic for Applications (VBA) : 0, Python (Programming Language) : 0, Adobe Photoshop CS4 : 0, Microsoft Outlook : 0, Written & Oral Presentation Skills : 0, """;"";2;;"Hospitality";3;"Kelvin Wong, Ho Lien Yang";"Kelvin Wong";"Ho Yang";"The Hong Kong Polytechnic University; CapitaLand; Gates Corporation; DBS Bank; Ngee Ann Polytechnic; Nanyang Technological University"
"idrisadenan";"Muhammad I.";"miba1991@gmail.com";"https://www.linkedin.com/in/idrisadenan/";"Muhammad";"I.";"Associate Financial Consultant";"https://media.licdn.com/dms/image/C5103AQF1Nv8_B7mrjA/profile-displayphoto-shrink_200_200/0?e=1576713600&v=beta&t=O0jzUVyb3G2nVJ0pQqaYpEFDx2TPpGze-GsYlmRuFjk";"Singapore";;;"To inspire in every millennials the capability to plan for tomorrow. ""If you fail to plan, you plan to fail”  Idris believes that financial planning is crucial and is to be done soon after someone starts his career. It forms as a guide on proper budgeting and also plan out the finances. Idris is a committed advisor that spend quality time with his prospects & clients on financial planning at their convenience. His passion is all about sharing with professionals in figuring out where they are, where they want to be and advising them how to achieve those.  Till date, Idris has helped and advised more than 80 individuals on financial planning.   Today as a friendly Financial Advisor, Idris is able to join his clients in the present to achieving greater things in the future.  www.prudential.com.sg/FC-info";;;;;;;;;;;;;;;;;"Prudential Assurance Company Singapore";"Associate Financial Consultant";"Nov 2017";"PRESENT";"To inspire in every millennials the capability to plan for tomorrow. ""If you fail to plan, you plan to fail”  Idris believes that financial planning is crucial and is to be done soon after someone starts his career. It forms as a guide on proper budgeting and also plan out the finances. Idris is a committed advisor that spend quality time with his prospects & clients on financial planning at their convenience. His passion is all about sharing with professionals in figuring out where they are, where they want to be and advising them how to achieve those.  Idris first started his savings endownment plan right after National Service and it has been a good 6 years. Idris has a good head start in his wealth accumulation. He has also protect his income from any unforeseen mishap and done investment to maximise the gain. Till date, Idris has helped and advised more than 80 individuals on financial planning.  Today as a friendly Financial Advisor, Idris is able to join his clients in the present to achieving greater things in the future.";"51 Scotts Road";"https://www.linkedin.com/company/prudential-assurance-company-singapore";"prudential-assurance-company-singapore";;;"Battery Asia (S) Pte Ltd";"Sales Engineer";"Mar 2015";"Aug 2017";"";"Singapore";"https://www.linkedin.com/search/results/index/?keywords=Battery%20Asia%20(S)%20Pte%20Ltd";;;;"Singapore Armed Forces (SAF)";"Lieutenant";"Jan 2014";"Dec 2014";"";"";"https://www.linkedin.com/company/singapore-armed-forces-saf";"singapore-armed-forces-saf";;;"Singapore Press Holdings";"Intern";"Jun 2011";"Dec 2011";"";"";"https://www.linkedin.com/company/singapore-press-holdings";"singapore-press-holdings";;;;;;;;;;;;;;;;;;;;;;;;;;;;;;;;;"Singapore Polytechnic";"Engineering with Business";"Engineering with Business";"";"2009";"2012";"";"Montfort Secondary School";"";"";"";"2004";"2008";"";;;;;;;;"""Customer Service : 6, Negotiation : 6, Sales Management : 3, Financial Planning : 2, Business Insurance : 1, Manufacturing : 1, Microsoft Office : 1, New Business Development : 2, Employee Benefit Solutions : 0, """;"4712";2;;"Financial Services";3;"Maliki 💎, Amelia Ng";"Maliki";"Amelia Ng";"Rapid7; Dr. Travis Bradberry; Kevin O'Leary; Jeff Weiner; Mary Barra; Rio Tinto"
"youkeatchia";"YouKeat Chia";;"https://www.linkedin.com/in/youkeatchia/";"Youkeat";"Chia";"Senior Financial Services Director at Prudential Assurance Company Singapore";"data:image/gif;base64,R0lGODlhAQABAIAAAAAAAP///yH5BAEAAAAALAAAAAABAAEAAAIBRAA7";"Singapore";;;"Co-founded PaceSetters Organisation in 2007, comprising of more than 100 consultants at present. I have mentored over 100 young entrepreneurs, multiple award-winning consultants and inspiring individuals through various platforms. I strongly believe that with the right mentoring and coaching, regardless of background or academic results, anyone can succeed.   My purpose in life is to help and groom young people who are driven and committed in pursuing their dreams in life. “As long as you decide to start afresh, anything is impossible. The moment you start making choices for the betterment of life, you start your path of change and success.”";;;;;;;;;;;;;;"http://www.pacesettersorganisation.sg";"https://www.instagram.com/youkeatchia/";"https://www.facebook.com/youkeat.chia";"Prudential Assurance Company Singapore";"Senior Financial Services Director";"Oct 2004";"PRESENT";"";"";"https://www.linkedin.com/company/prudential-assurance-company-singapore";"prudential-assurance-company-singapore";;;"Prudential Assurance Company Singapore";"Senior Financial Services Director";"Oct 2004";"PRESENT";"";"47 Scotts Road #18-01B Goldbell Towers Singapore 228233";"https://www.linkedin.com/company/prudential-assurance-company-singapore";"prudential-assurance-company-singapore";;;;;;;;;;;;;;;;;;;;;;;;;;;;;;;;;;;;;;;;;;;;;;;;;;;;;;;;;;;;;;;;;;;;;;;;;;"""Entrepreneurship : 2, Business Strategy : 1, Leadership Development : 1, Motivational Speaking : 0, Coaching & Mentoring : 0, """;"";2;;"Financial Services";14;"Koh Rui Xia Lynn, Ethel Sim";"Koh Xia Lynn";"Ethel Sim";"Prudential Assurance Company Singapore"
"jimmysklim";"Jimmy Lim";;"https://www.linkedin.com/in/jimmysklim/";"Jimmy";"Lim";"Enricher | Entrepreneur | Enterprise | Explorer";"https://media.licdn.com/dms/image/C5103AQH_IusMK58q6Q/profile-displayphoto-shrink_200_200/0?e=1576713600&v=beta&t=Ie1LErEq9MY_UeQvOlobH4S2OA5J75Oc6OWaYBrowjY";"Singapore";;"August 25";"Experienced Founder with a demonstrated history of working in the education management industry. Skilled in Operations Management, Management, Business Intelligence, Business Development, and Marketing Strategy. A strong business development professional with a Master of Business Administration (M.B.A.) focused on Business Administration and Management, General from Nanyang Business School.";;;;;;;;;;;;;;;;;"Oneberry Technologies Pte Ltd";"Regional Sales Manager";"Sep 2019";"PRESENT";"";"Singapore";"https://www.linkedin.com/company/oneberry";"oneberry";;;"101 VIK";"Director";"Jan 2019";"PRESENT";"";"Singapore";"https://www.linkedin.com/company/101-vik";"101-vik";;;"Liberty Insurance Pte Ltd.";"Business Insurance Solutions Specialist";"Dec 2018";"PRESENT";"Focus on Business Protection from Retails, Manufacturing, Office to Enterprise Solution.";"Singapore";"https://www.linkedin.com/company/liberty-insurance-pte-ltd--member-of-liberty-mutual-group-";"liberty-insurance-pte-ltd--member-of-liberty-mutual-group-";;;"Sompo Insurance Singapore Pte Ltd";"Business Insurance Solutions Specialist";"Oct 2018";"PRESENT";"Focus on Business Protection from Retails, Manufacturing, Office to Enterprise Solution.";"Singapore";"https://www.linkedin.com/company/sompo-insurance-singapore";"sompo-insurance-singapore";;;"Prudential Assurance Company Singapore";"Employee Benefits Specialist";"Jan 2018";"PRESENT";"""Happy Customers always supported and serviced by Happy and Healthy Employee. Regardless the employee works from frontend or backend. Happy and Healthy Employee one of the keys building a strong customer relationship.""";"Singapore";"https://www.linkedin.com/company/prudential-assurance-company-singapore";"prudential-assurance-company-singapore";;;"Prudential Assurance Company Singapore";"Financial Advisor";"Oct 2017";"PRESENT";"";"Singapore";"https://www.linkedin.com/company/prudential-assurance-company-singapore";"prudential-assurance-company-singapore";;;"Attila Cybertech Pte. Ltd.";"Business Development Director";"Oct 2016";"Sep 2017";"Attila Cybertech is a new Start-up 100% Singapore company. Our primary focus on Operation Technology (OT) by providing assessing, planning, designing, implementing and maintaining using secure by design principles. We are working very closely with Institute of Higher Learning (IHL) & R&D by closing the loop between academic & industry.";"Singapore";"https://www.linkedin.com/company/attila-cybertech";"attila-cybertech";;;"Nanyang Business School";"Master of Business Administration (M.B.A.)";"Business Administration and Management, General";"";"2014";"2015";"";"RMIT University";"Bachelor of Applied Science (B.A.Sc.)";"Information Technology";"Distinction";"1999";"2000";"";"Ngee Ann Polytechnic";"";"";"";"1993";"1996";"";"""Project Management : 24, Program Management : 11, Project Planning : 11, Strategy : 8, Marketing Strategy : 7, Troubleshooting : 6, Business Analysis : 5, Business Intelligence : 5, ITIL : 4, Cloud Computing : 4, Business Development : 4, Operations Management : 3, Integration : 3, Disaster Recovery : 3, Change Management : 3, IT Management : 3, Data Analysis : 2, IT Operations : 2, Software Development : 2, Business Strategy : 1, Enterprise Software : 4, Management : 6, Leadership : 4, CAPM : 1, Networking : 1, """;"1876";2;;"Information Technology & Services";1;"Maliki 💎";"Maliki";;"Oracle; Michael Moritz; Roche; Harvard Business Review; The Wall Street Journal; LinkedIn"
"yeo-nicholas-0a72b6147";"Yeo Nicholas";;"https://www.linkedin.com/in/yeo-nicholas-0a72b6147/";"Yeo";"Nicholas";"--";"https://media.licdn.com/dms/image/C5103AQHQ_LWVL-B8dw/profile-displayphoto-shrink_200_200/0?e=1576713600&v=beta&t=hPNfCb85aj0kzNNdD5YoGC1gLjohcOUKPbqkE0Y9CBI";"Singapore";;;"";;;;;;;;;;;;;;;;;"Prudential Assurance Company Singapore";"Financial Advisor";"May 2017";"PRESENT";"";"";"https://www.linkedin.com/company/prudential-assurance-company-singapore";"prudential-assurance-company-singapore";;;"Prudential Assurance Company Singapore";"PRUinternship 2017";"May 2017";"Jul 2017";"";"";"https://www.linkedin.com/company/prudential-assurance-company-singapore";"prudential-assurance-company-singapore";;;"Cartrack Asia Pacific";"Field Application Specialist";"May 2018";"Dec 2018";"Internship";"";"https://www.linkedin.com/company/cartrack-asia";"cartrack-asia";;;"Appco Group Asia";"Sales Leader";"Jun 2016";"Sep 2016";"• Field Representative for uber";"Singapore";"https://www.linkedin.com/company/appcogroupasia";"appcogroupasia";;;"Singapore Army";"Lieutenant";"Jun 2015";"Jun 2016";"Army Logistics Training Institute/ School of Logistics ( Commanders' Training Wing  • Appointed as Training Coordinating Officer/ Assistant Platoon Commander . • Involved in planning of Logistics Officer Cadet Course's training programme .";"Singapore";"https://www.linkedin.com/company/singapore-army";"singapore-army";;;"ST Electronics (Info-Software Systems) Pte. Ltd.";"Student Intern";"Nov 2013";"Feb 2014";"• Check cycle count and stock count • Calibrate, work in test on Automatic number plate recognition (ANPR) project • Involved in raw data analytics";"100 Jurong East Street 21";"https://www.linkedin.com/company/st-engineering";"st-engineering";;;;;;;;;;;;;"Singapore Institute of Technology";"Bachelor of Engineering - BE";"Telematics (Intelligent Transportation Systems Engineering)";"";"2016";"2019";"";"Nanyang Polytechnic";"";"Telematics";"";"2011";"2014";"";;;;;;;;"""Teamwork : 5, Leadership : 4, Microsoft Excel : 3, Social Media : 2, Microsoft Office : 2, C++ : 2, Visual Studio : 1, C : 1, Street Marketing : 1, """;"279";2;;"Information Technology & Services";1;"Kelvin Wong";"Kelvin Wong";;"Samsung Electronics; Accenture; Infineon Technologies; Oracle; J.P. Morgan; LinkedIn"
"george-tan-776a8a131";"George Tan";;"https://www.linkedin.com/in/george-tan-776a8a131/";"George";"Tan";"Business Development Manager at Hewlett Packard Enterprise";"https://media.licdn.com/dms/image/C5603AQG9HAtukc8d9A/profile-displayphoto-shrink_200_200/0?e=1576713600&v=beta&t=ENm1u9KaEFjWWy-h8gUkfhBE31etdpGp9yMgdnWEZzo";"Singapore";;;"Organized and analytical when undertaking professional assignments, I am also friendly and people-oriented, and can easily establish long-term relationships with people I am surrounded by. Highly enthusiastic and motivated to start new projects that can challenge my personal skills, I truly believe that my place is in a challenging environment where pressure pushes me to do more than I could have ever imagined and where new challenges shape my personality and make me improve in everything I do.";;;;;;;;;;;;;;;;;"Hewlett Packard Enterprise";"Business Development Manager";"Nov 2018";"PRESENT";"Conceptualized and designed end to end process for outsourced third party sales arm to handle direct, low value volume renewals which allow internal resources to focus on selling value services.  Forecasts and accurately report partner performance in order to ensure on time renewal of packaged services and to reduce erosion of installed base.  Analyze eligible base data and provide intelligence for sales team to follow up on potential opportunities.  Provide sales team with competitive pricing for customized solutions while ensuring compliance with internal policies.";"Singapore";"https://www.linkedin.com/company/hewlett-packard-enterprise";"hewlett-packard-enterprise";;;"Hewlett Packard Enterprise";"Services Sales Manager";"Jun 2018";"Nov 2018";"Joined as part of company's APAC Graduate Program 2018.  Primary role includes identifying growth opportunity, leads generation, driving greater and more consistent upsell and cross-sell revenue for enterprise support services to businesses thr";"Singapore";"https://www.linkedin.com/company/hewlett-packard-enterprise";"hewlett-packard-enterprise";;;"Prudential Assurance Company Singapore";"Financial Consultant";"May 2017";"PRESENT";"Provision of advisory services in terms of income protection, financial risk management, wealth accumulation, capital preservation and legacy planning through analysis of client's assets, cash flow, risk appetite and life stage.";"";"https://www.linkedin.com/company/prudential-assurance-company-singapore";"prudential-assurance-company-singapore";;;"GGR HOLDINGS LIMITED";"Accounts Intern";"Jun 2016";"Sep 2016";"";"36 Purvis Street";"https://www.linkedin.com/company/ggr-holdings-limited";"ggr-holdings-limited";;;"One Farrer Hotel";"Front Office/Concierge Executive";"Dec 2014";"Jun 2015";"";"";"https://www.linkedin.com/company/one-farrer-hotel";"one-farrer-hotel";;;"The Ritz-Carlton Hotel Company, L.L.C.";"Learning Associate";"Mar 2011";"Aug 2011";"";"Singapore";"https://www.linkedin.com/search/results/index/?keywords=The%20Ritz-Carlton%20Hotel%20Company%2C%20L.L.C.";;;;;;;;;;;;;;"University of London";"Bachelor of Science";"Banking and Finance";"";"2015";"2018";"";"Nanyang Polytechnic";"Diploma";"Hospitality and Resort Management";"";"2009";"2012";"";;;;;;;;"""SAP HANA : 0, SFDC : 0, Workday : 0, Data Analysis : 0, Business Development : 2, Financial Planning : 2, Financial Accounting : 2, Consultative Selling : 0, Microsoft PowerPoint : 0, Microsoft Excel : 0, Microsoft Word : 0, Microsoft Office : 0, MYOB : 2, """;"441";2;;"Information Technology & Services";1;"Jun Jek Wong, MBA";"Jun Wong";;"Prudential Assurance Company Singapore; Nanyang Polytechnic; NYP Hospitality & Tourism Group; Millennials of Hewlett Packard Inc. & Hewlett Packard Enterprise (Singapore); Business Insider; Hewlett Packard Enterprise"
"markseguerra";"Mark Seguerra";;"https://www.linkedin.com/in/markseguerra/";"Mark";"Seguerra";"iOS Developer at Prudential Assurance Company Singapore";"https://media.licdn.com/dms/image/C5603AQFLdM5IiyGIFQ/profile-displayphoto-shrink_200_200/0?e=1576713600&v=beta&t=H8EF7y02aVEiigOfvVd2c2xkGfZFPzeH2KZO5YAo8hc";"Singapore";;"August 20";"Experienced Information Technology Manager with a demonstrated history of working in the financial services industry. Skilled in JavaServer Pages (JSP), iOS, SQL, Requirements Analysis, and Hibernate. Strong information technology professional graduated from Lyceum of the Philippines University.";;;;;;;;;;;;;;;;;"Prudential Assurance Company Singapore";"Information Technology Manager";"Aug 2016";"PRESENT";"";"Singapore";"https://www.linkedin.com/company/prudential-assurance-company-singapore";"prudential-assurance-company-singapore";;;"AIA Singapore Private Ltd.";"Technical Analyst (iOS)";"Dec 2011";"Aug 2016";"";"Singapore";"https://www.linkedin.com/company/aia";"aia";;;"RemoteStaff Limited";"iOS Developer";"Jul 2011";"Nov 2011";"";"Australia";"https://www.linkedin.com/company/remotestaff";"remotestaff";;;"Scope International";"Software Consultant (iOS and Java)";"Nov 2007";"Nov 2011";"";"Malaysia";"https://www.linkedin.com/company/standardchartered";"standardchartered";;;"GXS";"Software Engineer";"Dec 2006";"Nov 2007";"";"Philippines";"https://www.linkedin.com/company/gxs";"gxs";;;"Oberthur Card Systems";"Jr. Software Developer";"Jul 2005";"Nov 2006";"";"Philippines";"https://www.linkedin.com/company/idemiagroup";"idemiagroup";;;;;;;;;;;;;"Lyceum of the Philippines University";"B.S. in Computer Science";"";"";"2001";"2005";"";;;;;;;;;;;;;;;"""iOS : 18, Java : 16, iOS Development : 13, Requirements Analysis : 12, Software Development : 8, SDLC : 2, JavaScript : 8, SQL : 8, Hibernate : 5, Microsoft SQL Server : 5, XML : 4, CSS : 4, Spring Framework : 3, HTML : 3, Spring : 2, MySQL : 2, Eclipse : 2, Java Enterprise Edition : 2, JSP : 2, Cascading Style Sheets (CSS) : 2, """;"";2;;"Information Technology & Services";1;"Rashid Ali";"Rashid Ali";;"GXS; GBST; Gemalto; Hitachi eBworx Sdn Bhd; Guy Kawasaki; Hunter Walk"
"oussama-benrahmoun";"Oussama Benrahmoun";;"https://www.linkedin.com/in/oussama-benrahmoun/";"Oussama";"Benrahmoun";"Senior Manager, Information Technology at Prudential Singapore";"data:image/gif;base64,R0lGODlhAQABAIAAAAAAAP///yH5BAEAAAAALAAAAAABAAEAAAIBRAA7";"Singapore";;;"• IT Senior Manager with extensive experience in Enterprise Information Management and Digital Transformation within Insurance & Financial industry.  • Technical & functional expertise in Customer Communication & Enterprise Content Management (CCM/ECM), Workflow & Process Automation, Business Intelligence & Data Analytics.  • Proven skills in Consulting Services, Project Management, Architecture & Technical Leadership.  • Results-focused leader and trustworthy team player, with strong adaptability in multicultural environments and continuous motivation to deliver innovative & business-oriented solutions.";;;;;;;;;;;;;;;;;"Prudential Assurance Company Singapore";"Senior Manager, Information Technology";"Oct 2018";"PRESENT";"Leading CCM Team to build omnichannel Customer Communication platform, enabling Digital experience for Prudential Customers & Financial Consultants.";"Singapore";"https://www.linkedin.com/company/prudential-assurance-company-singapore";"prudential-assurance-company-singapore";;;"Gfi Informatique";"Senior Consultant / Project Manager";"May 2017";"Sep 2018";"Managed multiple Process Automation projects for BNP PARIBAS Singapore - Wealth Management IT hub for Asian & European sites (Front Office, KYC and Account Management...)  Business Development: PreSales activities & Data Analytics practice within GFI Singapor";"Singapore";"https://www.linkedin.com/company/gfiworld";"gfiworld";;;"AXA";"Project Manager";"May 2015";"Apr 2017";"CCM/ECM Project Manager and Technical Lead within AXA Group Solutions - Opentext Exstream SME";"Paris Area, France";"https://www.linkedin.com/company/axa";"axa";;;"Consulting Services";"Project Manager / Technical Lead";"Nov 2012";"Apr 2017";"Managed various CCM/ECM projects for Insurance clients, implementing multi-channel Customer Communication & Content Delivery solutions, integrating Document Management & Workflow Automation systems.";"France";"https://www.linkedin.com/search/results/index/?keywords=Consulting%20Services";;;;"Sofaxis";"IT Consultant";"Jul 2008";"Oct 2012";"Design & Development of Document Management & Business Intelligence solutions, as part of global transformation of DEXIA Sofaxis’ Information System (multi-year program).";"Orléans Area, France";"https://www.linkedin.com/company/sofaxis";"sofaxis";;;"BSC FRANCE - Business Software Consulting";"IT Consultant";"Apr 2007";"Jul 2008";"Implemented Document Design & Production solutions for multiple clients. References: NATIXIS, GMF, DEXIA Sofaxis.";"Paris Area, France";"https://www.linkedin.com/company/bsc---business-software-consulting";"bsc---business-software-consulting";;;"BRINK'S Morocco";"IT Consultant / Business Analyst";"Aug 2006";"Mar 2007";"Business Analysis, Support and Change Management for a new Funds Transfer and Cash Management system within BRINK'S Morocco.";"Casablanca, Grand Casablanca, Morocco";"https://www.linkedin.com/search/results/index/?keywords=BRINK'S%20Morocco";;;;"Ecole Nationale Supérieure d'Informatique et d'Analyse des Systèmes - ENSIAS";"Master's degree - IT Engineer";"Information Technology & Business Intelligence";"";"2003";"2006";"";;;;;;;;;;;;;;;"""Enterprise Content Management : 0, Customer Communication Management : 0, Business Intelligence (BI) : 0, Project Management : 0, Agile & Waterfall Methodologies : 0, Consulting : 0, Solution Architecture : 0, Business Analysis : 0, Change Management : 0, Document Management : 0, Process Automation : 0, Business Process Re-engineering : 0, Business Intelligence : 0, Data Warehousing : 0, Data Mining : 0, Business Development : 0, Pre-sales : 0, Supply Chain Management : 0, Financial Services : 0, Insurance : 0, Extract, Transform, Load (ETL) : 0, Java J2EE : 0, Oracle : 0, Microsoft SQL Server : 0, .NET Framework : 0, Team Management : 0, Business Consulting : 0, Digital Transformation : 0, Customer Experience Management : 0, Workflow : 0, Output Management : 0, Data Architecture : 0, Data Analytics : 0, OpenText : 0, IBM FileNet : 0, Opentext Exstream : 0, Quadient GMC Inspire : 0, Microsoft BI Suite : 0, """;"";2;;"Information Technology & Services";1;"Jason Chen";"Jason Chen";;"Customer Communications Management (CCM); IBM; AXA; Standard Chartered Bank; Big Data, Analytics, Business Intelligence & Visualization Experts Community; Artificial Intelligence, Deep Learning, Machine Learning"
